"2457";"@EnriqueSantiago No tienen credibilidad,pero si la tuvieran tampoco debería dimitir la ministra. Esta cacería mediática y judicial que se ha organizado tapa cuestiones importantísimas:  La no comparecencia de Marlaska por la crisis en la valla d Melilla El caos en la sanidad de la Com. de Madrid" 
"2458";"<U+0001F534> El Congreso fuerza a Marlaska a dar explicaciones sobre la tragedia de la valla de Melilla el próximo día 30  https://t.co/db6MxGJzRr" 
"2459";"#ESPAÑA #GENERAL El Congreso cita a Marlaska para que comparezca el 30 de noviembre por la tragedia de Melilla https://t.co/5eaO1O8JGd https://t.co/pgzd5Hjm2T" 
"2460";"El Congreso cita a Marlaska para que comparezca el 30 de noviembre por la tragedia de Melilla https://t.co/3jl3O4toxT #ESPAÑA #GENERAL" 
"2461";"El Alto Comisionado para los Refugiados de la ONU envía un sutil toque de atención a Marlaska por la tragedia de Melilla https://t.co/Lxb44ZMkCi vía @La_SER" 
"2462";"El PP salva a Marlaska de la comisión de investigación sobre Melilla https://t.co/cw74twHC58" 
"2463";"El Congreso fuerza al ministro Marlaska a dar por fin explicaciones sobre la tragedia de la valla de Melilla el próximo día 30 https://t.co/OSwbAdt3k2" 
"2464";"#Ampliación <U+0001F4C5>Entre el 25 y el 30, los diputados podrán ver en la sede de @interiorgob todas las imágenes  <U+0001F5E3><U+FE0F>Los @populares insisten en que debe dimitir una vez que diga ""toda la verdad""  <U+0001F5DE><U+FE0F>Informan @MAYANTOXO y @miriamfmata<U+0001F447>https://t.co/PvrZz3V2RI" 
"2465";"¿Qué temen?  Es incomprensible que el PSOE se oponga a investigar los hechos en el Congreso. ¿Por qué en Tarajal lo exigía y ahora se opone?  En septiembre el ministro no respondió a las preguntas concretas y se evadió con generalidades, ¿hará lo mismo? https://t.co/uWQowBI75L" 
"2466";"SETROI #OPINIONES #NOTICIAS: Marlaska dará explicaciones en el Congreso el 30-N por la tragedia de Melilla. https://t.co/2PVH42XWoc ¿Podrías compartir este artículo #ultimahora #hora #noticia?" 
"2467";"El Congreso fuerza al ministro Marlaska a dar por fin explicaciones sobre la tragedia de la valla de Melilla el próximo día 30 https://t.co/mVTAFP8D3x" 
"2468";"@mariointer9 De hecho están pidiendo su dimisión cuando es mucho más grave y necesaria la dimisión de Marlaska por lo de Melilla o la de Ayuso por la sanidad en Madrid. Es lo de siempre, hacer ruido para que otras cosas pasen a segundo plano" 
"2469";"Marlaska se niega a mostrar en el Congreso las imágenes de la tragedia de la valla de Melilla https://t.co/C6FSjmSvZO" 
"2470";"EL PUTO DESCOJONO, NOS TOMAN POR TONTOS EL PP Y VOX, TODA LA PUTA SEMANA PIDIENDO LA DIMISION DEL CARNICERO MARLASKA Y AHORA VOTAN EN CONTRA Y TIRAN ABAJO UNA COMISIÓN DE INVESTIGACIÓN SOBRE LOS ASESINATOS DE LA VALLA DE MELILLA H I J O S  DE  LA  G R A N D I S I M A  P U T A !!!" 
"2471";"El Congreso no investigará los sucesos del 24J. A cambio, Marlaska deberá comparecer en la cámara el día 30 de este mes de noviembre #Melilla https://t.co/TBgpIfBfod" 
"2472";"Marlaska comparecerá el 30 de noviembre en el Congreso por la tragedia de Melilla https://t.co/jpLS3H5uc8" 
"2473";"<U+0001F449> El Gobierno de Sánchez y Podemos encadena escándalo tras escándalo  <U+274C>Marlaska faltó a la verdad en la tragedia de Melilla <U+274C>Rebaja de los delitos de sedición y malversación <U+274C>Los efectos negativos de la #LeySíesSí hacia las víctimas de violencia de género  <U+0001F3A5> @lgarridoknorr https://t.co/k0ZT8TSPsS" 
"2474";"..'los grupos verán las imágenes de Melilla en sesión secreta'.. en sesión secreta dicen! JO, JO, JO<U+0001F606> https://t.co/jcGxLFARhA" 
"2475";"La pinza la hacen los partidos para los que lo del 24J fue totalmente justificable: https://t.co/SnU4Cd9AKh" 
"2476";"setroi actualidad : El Congreso fuerza al ministro Marlaska a dar por fin explicaciones sobre la tragedia de la valla de Melilla el próximo día 30. setroi noticias: El Gobierno rechaza enviar a la Cámara los vídeos de lo acontecido en la frontera y propone a los grupos parlamenta" 
"2477";"El ministro volverá al pleno de la Cámara dos meses después de su primera comparecencia sobre la tragedia https://t.co/k9TMEUeQD6" 
"2478";"INMIGRACIÓN | Grande-Marlaska volverá a comparecer ante el pleno del Congreso el día 30 para dar explicaciones por la muerte de al menos veintitrés migrantes en la frontera de Melilla. https://t.co/6bM7nP3fVv" 
"2479";"Marlaska mostrará los vídeos de Melilla a partir del día 25 y se expondrá de nuevo ante el Congreso https://t.co/WpZa1HndYC" 
"2480";"Marlaska mostrará los vídeos de Melilla a partir del día 25 y se expondrá de nuevo ante el Congreso  https://t.co/cPmDZEGxG8" 
"2481";"El ministro Grande-Marlaska comparecerá ante el pleno del Congreso el próximo día 30 para dar explicaciones por la muerte de al menos veintitrés migrantes en la frontera de Melilla el 24 de junio. https://t.co/YDjutYeDqn" 
"2482";"El PP y Vox salvan a Marlaska de la comisión de investigación sobre Melilla https://t.co/O7YsYwUZpp #larazon_es" 
"2483";"#EnDirecto | Feijóo, tras tumbar junto al PSOE y Vox la comisión de investigación sobre Melilla: ""Aunque todo parezca indicar que Marlaska no dice la verdad, hemos pedido que comparezca antes de juzgarle en una comisión, y el Gobierno lo ha aceptado"" https://t.co/BIkrpwbkAp" 
"2484";"Marlaska cede: proyección de vídeos de Melilla bajo su control y después explicaciones al Congreso @ElPeriodico_Esp https://t.co/519NeqF10l" 
"2485";"Marlaska mostrará los vídeos de Melilla a partir del día 25 y se expondrá de nuevo ante el Congreso @ElPeriodico_Esp https://t.co/7G4OwsNNvg" 
"2486";"Marlaska mostrará los vídeos de Melilla a partir del día 25 y se expondrá de nuevo ante el Congreso https://t.co/s5rYoASnVA" 
"2487";"https://t.co/KzpMeu0b3T https://t.co/fJwPJlKAfR https://t.co/xFoVJy6Kws.B4C3T3 https://t.co/aNV7JT5IQ4 ALsDMedio  Marlaska comparecerá ante el Pleno del Congreso el día 30 y los grupos verán las imágenes de Melilla en sesión secreta https://t.co/Fi6KrJTtJM a través de @epnacional" 
"2488";"PP y Vox votan con el PSOE para salvar a Marlaska: No habrá investigación sobre las muertes en Melilla https://t.co/09i9pQMdt8" 
"2489";"PSOE y PP salvan a Marlaska de una investigación en el Congreso por Melilla https://t.co/VIlU64ZZOG" 
"2490";"Marlaska mostrará los vídeos de Melilla a partir del día 25 y se expondrá de nuevo ante el Congreso. El ministro volverá al pleno de la Cámara dos meses después de su primera comparecencia sobre la tragedia https://t.co/B1c8cwkw4v" 
"2491";"PSOE y PP salvan a Marlaska de una investigación en el Congreso por Melilla    https://t.co/jbzS2bYZQm" 
"2492";"ÚLTIMA HORA | PSOE y PP salvan a Marlaska de una investigación en el Congreso por Melilla https://t.co/gFx0KhZPcn https://t.co/13pinc1SGB" 
"2493";"<U+2192>https://t.co/CpsxgzjXSn Marlaska comparecerá ante el Pleno del Congreso el día 30 y los grupos verán las imágenes de Melilla en sesión secreta https://t.co/GavOpiOa2q #noticias" 
"2494";"@J_Zaragoza_ ACABÁIS DE VOTAR JUNTO A PP Y VOX NO INVESTIGAR MARLASKA Y MELILLA. SOIS LA MISMA MIERDA" 
"2495";"El PP y Vox salvan a Marlaska de la comisión de investigación sobre Melilla https://t.co/G88s8RNVOu #larazon_es   Muy bien, oye...  Soportaré a este hijo de puta, pero prefiero comerme el voto que darselo a ninguno de estos." 
"2496";"Es que son igualitos!  El PSOE y el PP vetan la comisión de investigación sobre Melilla, y a cambio Marlaska dará explicaciones el 30 de noviembre https://t.co/own9415s4y" 
"2497";"Marlaska mostrará los vídeos de Melilla a partir del día 25 y se expondrá de nuevo ante el Congreso https://t.co/3gkrhyp3fP" 
"2498";"PSOE, PP, Vox y Ciudadanos tumban la comisión de investigación sobre la tragedia de #Melilla https://t.co/XIGR5oWpCv  #Marlaska #GuardiaCivil #inmigración" 
"2499";"Marlaska mostrará los vídeos de Melilla a partir del día 25 y se expondrá de nuevo ante el Congreso https://t.co/uUItWwZa4I" 
"2500";"Se me está haciendo un poco indigesto lo de la Ley del #SoloSiesSi e Irene Montero. Y si volvemos a la valla de Melilla- y Marlaska?" 
"2501";"El Congreso cita a Marlaska ante el Pleno el día 30 y los portavoces podrán ver las imágenes de Melilla a puerta cerrada https://t.co/TVY4iFvFqJ" 
"2502";"El PSOE haciendo de PSOE  https://t.co/h9pD6IIrF6 a través de @el_pais" 
"2503";"@Capitana_espana No eches las campanas al vuelo. También debería cesar al ministro Marlaska por lo de Melilla y ahí están.  Todo con un desmedido caciquismo a medida y para sus intereses." 
"2504";"Marlaska comparecerá ante el Pleno del Congreso el día 30 y los grupos verán las imágenes de Melilla en sesión secreta https://t.co/yLANBGVaHH #Nacional" 
"2505";"Marlaska mostrará los vídeos de Melilla a partir del día 25 y se expondrá de nuevo ante el Congreso https://t.co/u1gSVYBmDZ" 
"2506";"SETROI #OPINIONES #NOTICIAS: PSOE y PP salvan a Marlaska de una investigación en el Congreso por Melilla. https://t.co/Byo36iqkPU ¿Podrías compartir este artículo #ultimahora #hora #noticia?" 
"2507";"Las rebajas de penas a violadores condenados en aplicación de la nueva ley de libertad sexual, conocida como 'sólo sí es sí', la tragedia en la valla de Melilla y la reforma del Código Penal son las crisis de Sánchez<U+0001F447> https://t.co/RR52hF3moi" 
"2508";"Marlaska comparecerá el 30-N por la tragedia de Melilla: PP y PSOE le salvan de una comisión https://t.co/oMRGaPzDDx" 
"2509";"<U+0001F534>Marlaska comparecerá el 30-N por la tragedia de Melilla: PP y PSOE le salvan de una comisión, por @Saradediego_  https://t.co/Y9bpTnnMFb" 
"2510";"<U+0001F6A8><U+0001F195>Marlaska comparecerá el 30 de noviembre en el Congreso por la tragedia de Melilla<U+0001F447>https://t.co/jt27WjMnLX https://t.co/jsqSkMkt2N" 
"2511";"#LaCasaDelFútbol  #MBS #IRAN #ALJAZEERA #MARLASKADIMISIÓN MarlaskA/ #Melilla;debe dimitir y sí tienen q rodar + cabezas tb.  SÍ ESTO PASA EN OTRO SITIO, X EJEMPLO EN #THEKINGDOMSAUDIARABIA, algunos ya estarían CRUCIFICANDO A MBS. EL PP PARA ESTO SÍ, PARA LOS TRABAJADORES NO ESTÁ. https://t.co/EoYlLp7JRx" 
"2512";"Marlaska comparecerá el 30 noviembre en Congreso por la tragedia de Melilla   El PP espera que el ministro, después de esta comparecencia, ""facilitando toda la información y diciendo toda la verdad, DIMITA""  https://t.co/acluzld9df @Servimedia @miriamfmata" 
"2513";"@ivanedlm Y porqué os habéis negado a investigar esto? <U+0001F447> https://t.co/Nms2G0wgRo" 
"2514";"<U+0001F534> Directo | Marlaska comparecerá ante el Pleno del Congreso el día 30 y los grupos verán las imágenes de Melilla en sesión secreta https://t.co/qctLq1lkcv https://t.co/LID5GWnYgS" 
"2515";"El Congreso cita a Marlaska el día 30 y los portavoces podrán ver las imágenes de Melilla https://t.co/CYAVJC3WOP #AndaluciaInformacion #España" 
"2516";"<U+0001F534> El Congreso no investigará a Marlaska por la tragedia de Melilla gracias a PSOE, PP y Vox. Por Andrés Pelayo (@andrespelayo1). https://t.co/TjdOBayq7L" 
"2517";"PSOE y PP tumban la petición de comisión de investigación sobre la tragedia de Melilla.  Es vergonzoso. El ministro de Interior sigue mintiendo y escondiéndose y el presidente sigue encubriéndole y encubriendo al Reino de Marruecos.  #EditorialCrudo: Marlaska dimisión <U+0001F447> https://t.co/Dd3ORAzOpZ" 
"2518";"El #Congreso cita al ministro Marlaska el 30 de noviembre en el Pleno para informar de la tragedia de la valla de Melilla. Y unos días antes deberá mostrar las imágenes que grabó Interior https://t.co/gqNYH7lXL3 La comisión de investigación, de momento, no se lleva a votación" 
"2519";"Marlaska comparecerá ante el Pleno del Congreso el día 30 y los grupos verán las imágenes de Melilla en sesión secreta https://t.co/2GoDIpQbVI" 
"2520";"Que cosas... ""El Congreso no investigará a Marlaska por la tragedia de Melilla gracias a PSOE, PP y Vox"" https://t.co/dpCsADDLzv vía @TheObjective_es" 
"2521";"PP y Vox salvan a Marlaska de la comisión de investigación por la tragedia de Melilla que pedían sus socios parlamentarios.  Hace una semana contábamos como el PSOE recurre al PP para las cuestiones sensibles <U+0001F447><U+0001F3FC> https://t.co/nmdTE7M1KO" 
"2522";"<U+2B55><U+FE0F> ÚLTIMA HORA | Marlaska mostrará los vídeos de Melilla a partir del día 25 y se expondrá de nuevo ante el Congreso  <U+270D><U+FE0F><U+0001F3FB> Informa @AlonsoNgel   https://t.co/DRrwUbCT0L" 
"2523";"Marlaska explicará la tragedia de Melilla ante el pleno del Congreso el 30 de noviembre https://t.co/KUp9rbrjRX" 
"2524";"@dsegoviaatienza Que cosas más raras pasan en esta democracia tan plena que nos vende, él trápala del @sanchezcastejon, los criminales @populares, que pedían la dimisión del fascista de @interiorgob, Marlaska, ahora se ponen de acuerdo para no investigar lo de Melilla, @cucagamarra desvergonzada" 
"2525";"#Nacional Marlaska comparecerá ante el Pleno del Congreso el día 30 y los grupos verán las imágenes de Melilla en sesión secreta https://t.co/3m4G9crxPX https://t.co/pV4dB7x6qU" 
"2526";"ÚLTIMA HORA <U+0001F534>  PSOE y PP tumban la comisión de investigación por la tragedia de Melilla que pedían Unidas Podemos y los socios del Gobierno   Marlaska comparecerá el 30 de noviembre en el Congreso https://t.co/85IeklYBSa https://t.co/v0BLaFD0ZU" 
"2527";"Es muy difícil creer en una persona que cuando da una rueda de prensa dice una cosa y luego hace otra, lo de votar junto al PSOE para impedir una investigación sobre lo ocurrido en Melilla me parece un error, van a pagar los guardias cuando la culpa fue de marlaska, PP = PSOE. https://t.co/rDlhs6CLOx" 
"2528";"Marlaska explicará la tragedia de Melilla ante el pleno del Congreso el 30 de noviembre   https://t.co/84XhDCferS" 
"2529";"El PP y Vox salvan a Marlaska de la comisión de investigación sobre Melilla https://t.co/qhAGB5neEr #larazon_es" 
"2530";"Apoyamos la comparecencia del ministro Grande-Marlaska.  También, el representante del Gobierno en la Junta de Portavoces ha anunciado la disposición del @interiorgob para que los grupos parlamentarios puedan acceder al visionados de las imágenes de Melilla.  <U+0001F5E3><U+FE0F>@isauralealf https://t.co/FPm5J7VSS9" 
"2531";"<U+0001F4CC> El PP y Vox salvan a Marlaska de la comisión de investigación sobre Melilla <U+27A1> El ministro del Interior sí que tendrá que comparecer para dar explicaciones sobre la tragedia https://t.co/5kpBJyRlzr" 
"2532";"PSOE-PP-VOX se vuelven a aliar para blindar el R78, como ya hacen habitualmente con la corrupción monárquica, ahora lo hacen con Marlaska que NO HABRÁ COMISIÓN INVESTIGACIÓN por los asesinatos de Melilla. La impunidad represiva o la corrupción del R78 BLINDADA.#MarlaskaDimision https://t.co/88GWmYJoY9" 
"2533";"No, a la comisión de investigación en el Parlamento. 23 muertos. ""Total...son negros"" #Psoe #Podemos #Marlaska #PartidoSocialista #PP #Vox #SoloSiesSi #PartidoPopular #MinisterioDelInterior #MinistroDelInterior #Melilla #Tragedia  #TragediaDeMelilla" 
"2534";"@javiercasqueiro @el_pais Marlaska aún no explicado lo de la hamburguesa va a explicar lo de Melilla" 
"2535";"Proteger a la G.C sin duda. El dilema del PP con la tragedia de Melilla: seguir atacando a Marlaska o proteger a la Guardia Civil https://t.co/VUPF99ddlf" 
"2536";"<U+203C><U+FE0F> PSOE y PP tumban la petición de comisión de investigación sobre la tragedia de Melilla https://t.co/CcQN2SLGU8  -<U+27A1><U+FE0F> Marlaska comparecerá el próximo día 30 para rendir cuentas por la matanza en la que murieron decenas de migrantes  -<U+27A1><U+FE0F> El Parlamento no investigará los hechos" 
"2537";"Marlaska explicará la tragedia de Melilla ante el pleno del Congreso el 30 de noviembre https://t.co/axG5syI8no https://t.co/FuevpsSg0v" 
"2538";"El ministro Grande-Marlaska comparecerá en el Congreso el 30 de noviembre para dar explicaciones sobre la tragedia del #24J en la frontera de Melilla. No habrá, eso sí, comisión de investigación." 
"2539";"Marlaska comparecerá en el pleno del Congreso el próximo 30 de noviembre para dar explicaciones sobre la muerte de al menos 23 migrantes durante el salto a la valla de Melilla  https://t.co/mCi9FuHeyx https://t.co/CJs98PQsCW" 
"2540";"@budino_antonio @JLHG1974 @sanchezcastejon No podemos olvidarnos del traidor Marlaska, y los muertos en Melilla ,de la rebaja de la sedición y malversación,para los amigos del golpista traidor Sánchez,de la ley no es no de Sánchez el traidor y su lacaya,de las niñas abusadas en Mallorca etc" 
"2541";"<U+0001F534> ÚLTIMA HORA | El Congreso acaba de rechazar la comisión de investigación sobre el salto a la valla de Melilla  <U+25AA><U+FE0F> El ministro del Interior, Fernando Grande-Marlaska, comparecerá ante el pleno el próximo 30 de noviembre  <U+0001F399><U+FE0F> @rosabarcia  https://t.co/gIfd6HsZhE https://t.co/C593gHUCq9" 
"2542";"SETROI NOTICIAS. Marlaska explicará la tragedia de Melilla ante el pleno del Congreso el 30 de noviembre. https://t.co/Pi5jIkwsPi https://t.co/54oWMSRZUM #NOTICIAS Los diputados de la comisión de Interior podrán acceder a los vídeos grabados por las fuerzas de seguridad" 
"2543";"<U+0001F3DB><U+FE0F><U+0001F535>El PP lleva semanas pidiendo la dimisión de Marlaska por la tragedia de Melilla. Hoy tenía en su mano que saliera la comisión de investigación en el Congreso, pero se ha unido al PSOE para tumbarla.   Se ponen de acuerdo para lo que les interesa. https://t.co/JFt8c09nuQ" 
"2544";"El ministro Marlaska explicará la tragedia de Melilla ante el pleno del Congreso el 30 de noviembre: Los diputados de la comisión de Interior podrán acceder a los vídeos grabados por las fuerzas de seguridad a partir del día 25.  https://t.co/MosqV0Mhfx" 
"2545";"<U+25AA><U+FE0F> Marlaska comparecerá en pleno por Melilla  <U+25AA><U+FE0F> Lo habían pedido PP y Ciudadanos y será el 30 de noviembre  Informa @SandraMunoz_tve   #LaHora18N  <U+0001F4F9> https://t.co/9k8zsHR5nu https://t.co/jidKeH9XDU" 
"2546";"“El ministro Marlaska comparecerá en el pleno el próximo 30 de noviembre para dar explicaciones sobre la muerte de los migrantes.”  https://t.co/G4wlv0kpPe" 
"2547";"Marlaska comparecerá en el Congreso por la tragedia de Melilla pero evita una comisión de investigación https://t.co/IaidPYBTuk" 
"2548";"::URGENTE::: El ministro Marlaska tendrá que comparecer en el Congreso el 30 de noviembre por la tragedia de Melilla pero el PSOE evita  una comisión de investigación gracias al PP https://t.co/DHtK24vS4h" 
"2549";"@Macca15Paul Creo que también han opacado las muertes en Melilla siendo Marlaska ninistro y la eliminación del delito de sedición para favorecer a los colegas. Por no hablar de déficit público entre otras lindezas" 
"2550";"@GIlda__2001 @IreneMontero Cada día va a ver más delincuentes sexuales en las calles y no creo que los socialistas puedan aguantarlo mucho tiempo, pronto hay elecciones y esto les puede hacer perder muchos votos. Además está reciente lo de Marlaska en la frontera de Melilla y lo de la sedición." 
"2551";"Ayer Marlaska debería haber venido al @Europarl_ES a dar explicaciones por lo sucedido en #Melilla el #24J. Es una vergüenza que no tenga la decencia de venir, será porque algo oculta. El gobierno español es cómplice de esta matanza, Marlaska debe dimitir #MarlaskaDimisión https://t.co/ZM0W0Pe4Jf" 
"2552";"Es curioso lo rápido que crecen los malestares en el PSOE con las cosas de 'otros', pero no con, por ejemplo, la gestión de Marlaska en la valla de Melilla. https://t.co/qqnemonEWz" 
"2553";"Marlaska mintiendo sobre una matanza en Melilla, Irene Montero sacando violadores de prisión y Dimitir es el lateral derecho de Rumanía." 
"2554";"El escándalo de la secesión lo tapó Marlaska con la valla de Melilla,y a este lo tapa Montero con la Ley del Sí es Si, parece que Sanchez le ha pedido a Pilar Alegria una cagada urgente porque le toca ya…… #LeyDelSiesSi #IreneMonteroDimision #IreneMonteroAPrision #IreneMontero" 
"2555";"@Lei_Leys @jmazabuelq Marlaska está muy contento porque le han dejado en paz con lo de Melilla" 
"2556";"Marlaska, agradeciendo las basuras de Irene Montero para que no se hable de sus miserias acercando etarras y en la frontera de Melilla." 
"2557";"Después de la sedición, la malversación, la salida de delincuentes sexuales a la calle, la inflación al 7,3% y la crisis de Melilla y Marlaska, qué menos que el CIS le otorgue hoy al PSOE 150 o 160 escaños." 
"2558";"En el caso de la valla de Melilla se esperará a la actuación de la Fiscalía y en el de la ley de libertad sexual la intención es escuchar al Tribunal Supremo https://t.co/0T9qm3BmwM" 
"2559";"Si es Si, tapa lo de la Sedición de Sánchez que tapaba lo de la valla de Melilla de Marlaska.  Irene Montero deseando que aparezca una nueva polémica para diluirse tras ella." 
"2560";"Socialistas europeos se unen a otros grupos en el Parlamento Europeo y piden investigación independiente sobre tragedia en Melilla  PP y Anticapitalistas critican la ausencia de Marlaska y el PSOE defiende que irá cuando concluyan las investigaciones https://t.co/rGpQPodXZ9" 
"2561";"@PabloIglesias Fuistéis a Melilla a poner contra las cuerdas a Marlaska. ¿Qué quieres que hagan ellos ahora? Jolines, Pablo, te lo vuelvo a repetir: ¿Te has caído de un guindo o te crees que nos hemos caído nosotros?" 
"2562";"@Macca15Paul Si Paul, y le han pedido ayuda a Antonio Maestre, Joan Guirao, https://t.co/Q2cskT28m4... ¡anda ya! Sois burros, prepotentes y os tenían ganas vuestros propios socios. Por la obcecación con la ley trans y por haber ido a por Marlaska en lo de Melilla." 
"2563";"Y los muertos de Marlaska en Melilla ?? Ya nadie dice nada ?" 
"2564";"Servicios de Detectives:  No es Petare ni la favela de Rocinha. Es un edificio en Melilla. Esa es la seguridad que da España a sus ciudadanos.  Se Marlaska la tragedia. https://t.co/ztK1iq8tkD" 
"2565";"@NunezFeijoo Al los únicos que debe cesar Sánchez es a Marlaska por lo de la valla de Melilla y a Margarita Robles que se ha equivocado de partido político" 
"2566";"ACORRALADOS. Por qué Marlaska acepta ahora enseñar las imágenes de la tragedia de Melilla y qué pueden revelar https://t.co/56yDbNHbXU" 
"2567";"@eldiarioes Irene Montero debe dimitir por haber rebajado las penas a los abusadores.  Grande Marlaska debe dimitir por los crímenes de la vaya de Melilla.  Y Pedro Sánchez debe acabar entre rejas por PREVARICAR con la eliminación del delito de sedición y la rebaja del de malversación." 
"2568";"@TrainerExtreme Marlaska (ministro PSOE). Quien habla hoy del tema de Melilla?? Nadie. Sánchez usa a Montero como cabeza de turco, no el PP." 
"2569";"El escándalo de eliminar el delito de secesión fue tapado por los muertos en Melilla y las mentiras de Marlaska que, a su vez, ha sido tapado por la incompetencia de Irene Montero y su ley nefasta.  #Atodotrapo #GobiernoDelCambio" 
"2570";"@Franmimalaga Alfredo Landa cortina de humo para tapar  la sedición, el jaleo de Marlaska en Melilla y la “Monterada” del solo sí es sí. ¿Cuál será la próxima?" 
"2571";"Marlaska no ve que la guardia civil hiciera ningún abuso en melilla, como no quiso ver las torturas en intxaurrondo y La salve" 
"2572";"<U+0001F534>Marlaska —&gt; Valla de Melilla <U+0001F534>Sánchez —&gt; Eliminar la sedición  <U+0001F534>Robles —&gt; No es lo mismo robar al estado (malversación) para enriquecerse personalmente que para beneficiar a terceros.  <U+0001F534>Irene Montero —&gt; la lía con la Ley del “Sí es Sí” y pronto la liará con la “Ley Trans”" 
"2573";"Marlaska sucio por Melilla, Antonio por la sedición, la cajera por el #SiEsSiNoEsIguadad. Alguna mierd4 más?" 
"2574";"¿Ahora que nos entretienen con la cajera ya nos hemos olvidado de Marlaska?  La Unión Europea ha pedido una investigación de lo ocurrido en Melilla...  TIC TAC TIC TAC..." 
"2575";"CASO MARLASKA <U+0001F534><U+0001F534><U+0001F534> Socialistas europeos se unen a otros grupos en el Parlamento Europeo y piden una investigación independiente ""sobre  tragedia en Melilla"" https://t.co/T0E8UXQiEl" 
"2576";"@tomascasascm Tomasen que no entiendes nada. Vosotros dejasteis tirado a Marlaska la semana pasada en el tema Melilla; ello os pasan la factura esta semana con el si es si. No sois una coalición, sois una banda." 
"2577";"@Europarl_EN llamó a comparecer al ministro Marlaska en julio para hablar de la tragedia de Melilla y la frontera sur de la UE. Ahora, dice que no tiene nada que ocultar, pero rechaza comparecer. Es la primera vez que sucede esta legislatura. Una vergüenza.https://t.co/lNhpqei57W" 
"2578";"La semana pasada teníamos “la cortina de humo” del salto a Melilla y las mentiras de Marlaska… esta semana eso se tapa con la nueva paranoia de la Montero y así cada semana." 
"2579";"Urbán acierta. La  evidente complicidad de GM en los crímenes en la valla de Melilla el 24 de junio,   llevan a la misma conclusión GM debe dimitir y Sánchez asumir responsabilidades.                  GRANDE-MARLASKA DIMISIÓN YA  https://t.co/mJrbbwEbpw" 
"2580";"@sevigliaABP Una espuerta llena, Antonio, que mira lo calladitos que están con los fallecidos en Melilla. Marlaska los oculta y calladitos, pero tú dices morito y a rasgarse las vestiduras. Aburren a las ovejas." 
"2581";"Y.. mr. Marlaska --&gt; https://t.co/pZzZzY8Oi4" 
"2582";"El PSOE y la burocracia del Congreso permiten a Marlaska eludir su comparecencia sobre la tragedia de Melilla https://t.co/lwl2rSjir0" 
