"1397";"Sánchez tiene que cesarlo como ministro de manera inmediata.  El Defensor del Pueblo deja en evidencia a Marlaska al no creer su versión sobre la tragedia de la valla de Melilla https://t.co/CLRQvUcW1f" 
"1398";"El PP pide la comparecencia de Pedro Sánchez por la “pésima gestión” en la valla de Melilla https://t.co/w4TKrlBhM8 #larazon_es" 
"1399";"@OsadoImpertine @NoaGresiva España está en venta por vosotros, vosotros no tenéis las agallas para criticar a Marlaska por el asesinato de la valla de Melilla. Ni tenéis las agallas para criticar a Borrell que es el jefe de la diplomacia y está arruinando España. Esa oposición de narcos que defiendes." 
"1400";"<U+0001F92C><U+0001F92C><U+0001F92C><U+0001F92C><U+0001F92C><U+0001F92C><U+0001F92C><U+0001F92C><U+0001F92C><U+0001F92C><U+0001F92C>El Defensor del Pueblo deja en evidencia a Marlaska al no creer su versión sobre la tragedia de la valla de Melilla https://t.co/U1h5Kr7mcd a través de @ABCespana" 
"1401";"Marlaska miente mas que Sánchez: El Defensor del Pueblo invalida la versión de Marlaska sobre la tragedia de la valla de Melilla: 'No podemos compartir sus afirmaciones""." 
"1402";"El PP pide la comparecencia de Pedro Sánchez por la “pésima gestión” en la valla de Melilla <U+27A1> Los populares critican la falta de transparencia del Gobierno y el respaldo “categórico” del presidente a Marlaska https://t.co/XE7HRLoQjs" 
"1403";"La Guardia Civil ha recibido nuevo material policial, como 150 cascos antidisturbios y 150 máscaras antigás, con el objeto de reforzar la protección de los agentes del Cuerpo en su tarea de control de la presión migratoria en la valla de Melilla   https://t.co/5d49P4C5oJ https://t.co/M0JGjqLWBc" 
"1404";"El Defensor del Pueblo no cree la versión de Interior sobre la actuación policial en la valla de Melilla https://t.co/tWQru1Qlbj a través de @La_SER" 
"1405";"@OsadoImpertine @NoaGresiva Vosotros defendeis a Marlaska asesinando en la valla de Melilla igual que defendeis a Borrell renegando de la diplomacia. Defendeis a vox queriendo ilegalizar a Bildu para que vuelvan a las armas y defendeis la legalización de las armas para matar." 
"1406";"El Defensor del Pueblo no cree la versión de Interior sobre la actuación policial en la valla de Melilla. Deja en evidencia todas las ilegalidades llevadas a cabo el 24J por España. Con @JaviBanuelos https://t.co/mEyy8ka4eu vía @La_SER" 
"1407";"Y ahora qué.El Defensor del Pueblo invalida la versión de Marlaska sobre la tragedia de la valla de Melilla: 'No podemos compartir sus afirmaciones"" https://t.co/A5UVRNv7Ay" 
"1408";"El Defensor del Pueblo deja en evidencia a Marlaska al no creer su versión sobre la tragedia de la valla de Melilla  POR @pablomunozabc  https://t.co/gjc0swz1pI" 
"1409";"El Defensor del Pueblo deja en evidencia a Marlaska al no creer su versión sobre la tragedia de la valla de Melilla https://t.co/bYJK6K5dRT a través de @ABCespana" 
"1410";"Registramos la solicitud de comparecencia urgente de Sánchez: “El Gobierno debe dejar de fingir que no ha pasado nada en la valla de Melilla, tiene que ser el primero en dar la cara y tomar las medidas oportunas”. https://t.co/A1QhJHFTIA" 
"1411";"@EDGC82784647 @PabloEchenique @publico_es Vosotros defendeis a Marlaska asesinando en la valla de Melilla igual que defendeis a Borrell renegando de la diplomacia. Defendeis a vox queriendo ilegalizar a Bildu para que vuelvan a las armas y defendeis la legalización de las armas para matar." 
"1412";"El Defensor del Pueblo invalida la versión de Marlaska sobre la tragedia de la valla de Melilla  https://t.co/OthYa7Z4Yn" 
"1413";"@Interes10244842 @BruckyC @BarkingCorgi @selasmelas @ierrejon Vosotros defendeis a Marlaska asesinando en la valla de Melilla igual que defendeis a Borrell renegando de la diplomacia. Defendeis a vox queriendo ilegalizar a Bildu para que vuelvan a las armas y defendeis la legalización de las armas para matar." 
"1414";"@selasmelas @ierrejon El discurso de defensa a ultranza a Marlaska asesinando en la valla de Melilla me lo conozco a pies juntillas, junto con vuestra defensa de Borrell renegando de la diplomacia para arruinar este país. Vosotros los miserables fascistas, vendidos por dos lonchas de campofrio." 
"1415";"setroi actualidad : El Defensor del Pueblo invalida la versión de Marlaska sobre la tragedia de la valla de Melilla: 'No podemos compartir sus afirmaciones"". setroi noticias: El organismo dirigido por Ángel Gabilondo cuestiona sus explicaciones y detalla por qué no se cree las ex" 
"1416";"El Defensor del Pueblo deja en evidencia a Marlaska al no creer su versión sobre la tragedia de la valla de Melilla https://t.co/DTump92pRG a través de @ABCespana Por @pablomunozabc" 
"1417";"El Defensor del Pueblo invalida la versión de Marlaska sobre la tragedia de la valla de Melilla: 'No podemos compartir sus afirmaciones"" https://t.co/S0yqQiW3qM https://t.co/H4NlnakoHP" 
"1418";"El Defensor del Pueblo invalida la versión de Marlaska sobre la tragedia de la valla de Melilla: 'No podemos compartir sus afirmaciones"" https://t.co/Zidz30mc0w" 
"1419";"@mejoreszasca @AfueraX @tresmasciento Vosotros defendeis a Marlaska asesinando en la valla de Melilla igual que defendeis a Borrell renegando de la diplomacia. Defendeis a vox queriendo ilegalizar a Bildu para que vuelvan a las armas y defendeis la legalización de las armas para matar." 
"1420";"Ahí lo dejo El Defensor del Pueblo deja en evidencia a Marlaska al no creer su versión sobre la tragedia de la valla de Melilla https://t.co/KUUFpznRXT a través de @ABCespana" 
"1421";"El Defensor del Pueblo deja en evidencia a Marlaska al no creer su versión sobre la tragedia de la valla de Melilla #123INFO https://t.co/jYfZHd2MOC" 
"1422";"@DesdeShequetito @Wachuzo @aantuuuan90 @vitoquiles Vosotros defendeis a Marlaska asesinando en la valla de Melilla igual que defendeis a Borrell renegando de la diplomacia. Defendeis a vox queriendo ilegalizar a Bildu para que vuelvan a las armas y defendeis la legalización de las armas para matar." 
"1423";"El Defensor del Pueblo deja en evidencia a Marlaska al no creer su versión sobre la tragedia de la valla de Melilla https://t.co/kQtYJyarFG" 
"1424";"Interior tan solo ha incrementado con cinco guardias civiles la plantilla de Melilla en los últimos cinco años pese a los asaltos multitudinarios a la valla fronteriza. https://t.co/3pvqcJ9KUm" 
"1425";"El #DefensorDelPueblo no cree la versión de @interiorgob sobre la actuación policial en la #VallaDeMelilla #MarlaskaDimisiónYa!! #EquiparacionYa  https://t.co/iS1A6NpkAj" 
"1426";"El Defensor del Pueblo no cree la versión de Interior sobre la actuación policial en la valla de Melilla https://t.co/oWsO0YJp8I a través de @La_SER" 
"1427";"El Defensor del Pueblo deja en evidencia a Marlaska al no creer su versión sobre la tragedia de la valla de Melilla #123INFO https://t.co/jYfZHdkodc" 
"1428";"#MariaJesusMontero, Ministra de Hacienda del  #PSOE, rechaza la comisión de investigación para esclarecer la masacre en la valla de Melilla https://t.co/xmN2K5AwDd" 
"1429";"El Defensor del Pueblo deja en evidencia a Marlaska al no creer su versión sobre la tragedia de la valla de Melilla https://t.co/gWkAZRqazX" 
"1430";"@MisterGafan Nahuel Molina y Acuña tú tienen menos seguridad que la valla de Melilla" 
"1431";"Gabilondo, un metafísico, «cuestiona punto por punto» el discurso político de un ex-juez. Marlaska, qué rasca. Abrígate que vas a coger frío https://t.co/KslbIZUfSG" 
"1432";"@neo_1404 @vitoquiles Vosotros defendeis a Marlaska asesinando en la valla de Melilla igual que defendeis a Borrell renegando de la diplomacia. Defendeis a vox queriendo ilegalizar a Bildu para que vuelvan a las armas y defendeis la legalización de las armas para matar." 
"1433";"El Defensor del Pueblo deja en evidencia a Marlaska al no creer su versión sobre la tragedia de la valla de Melilla https://t.co/mjdykoGdtm" 
"1434";"@Andrespatriaesp @vitoquiles Vosotros defendeis a Marlaska asesinando en la valla de Melilla igual que defendeis a Borrell renegando de la diplomacia. Defendeis a vox queriendo ilegalizar a Bildu para que vuelvan a las armas y defendeis la legalización de las armas para matar." 
"1435";"Gabilondo demuestra que el papel asignado en la comunidad de Madrid no estaba a su altura. @DefensorPuebloE no cree la versión del Ministerio del Interior sobre la actuación policial en la valla de Melilla  https://t.co/C5HhBPdo2J" 
"1436";"La tira de hoy en Deia, Noticias de Gipuzkoa y Noticias de Álava #Ministerio #Interior #Melilla #Valla #Crisis #GuerraSucia #Marlaska #Barrionuevo @deia_eus https://t.co/n3WTCafVjC" 
"1437";"#NACIONAL. La oficina de Ángel Gabilondo cuestiona punto por punto las explicaciones de Marlaska, entrega a la Fiscalía testimonios y partes médicos de superviviente y pide que se deje de expulsar ilegalmente a la gente. https://t.co/bacTcEO9gk" 
"1438";"El PP exige que Sánchez comparezca en el Congreso por la tragedia de la valla de #Melilla. https://t.co/PeLaelNVkw" 
"1439";"""El escándalo de la sedición no debe tapar lo ocurrido en la valla de Melilla"", ha advertido la portavoz del partido en el Congreso, Cuca Gamarra https://t.co/tLToO95w4z" 
"1440";"El Defensor del Pueblo no cree la versión de Interior sobre la actuación policial en la valla de Melilla https://t.co/di2lYhZyTl vía @La_SER" 
"1441";"Despertó.! Cuando despertara con lo de las residencias de ancianas y ancianos.! https://t.co/ugCKvKs6ib" 
"1442";"El Defensor del Pueblo no cree la versión de Interior sobre la actuación policial en la valla de Melilla https://t.co/LTxgguAIZ4 via @La_SER" 
"1443";"@DiegoyMyryam @PabloEchenique @publico_es Vosotros defendeis a Marlaska asesinando en la valla de Melilla igual que defendeis a Borrell renegando de la diplomacia. Defendeis a vox queriendo ilegalizar a Bildu para que vuelvan a las armas y defendeis la legalización de las armas para matar." 
"1444";"@MAJANO124 @PabloEchenique @publico_es Vosotros los fascistas solo defendeis la  mentira, el insulto y la muerte. Vosotros defendeis a Marlaska asesinado en la valla de Melilla. Defendeis a Borrell renegando de la diplomacia y os encumbrais como gente de paz. Miserables, escoria fascista." 
"1445";"Ni nadie...  El Defensor del Pueblo no cree la versión de Interior sobre la actuación policial en la valla de Melilla  https://t.co/aTF9SpLs6C   vía @La_SER" 
"1446";"El candidato a PINOCHO del año y de origen vasco va ganando. Ya sabemos que en este país la conjugación del dimitir no se lleva en la cartera, pero…  El Defensor del Pueblo no cree la versión de Interior sobre la actuación policial en la valla de Melilla https://t.co/E9sFEK5fpG" 
"1447";"El Defensor del Pueblo no cree la versión de Interior sobre la actuación policial en la valla de Melilla https://t.co/pMS00DrQyp a través de @La_SER" 
"1448";"El Defensor del Pueblo no cree la versión de Interior sobre la actuación policial en la valla de Melilla https://t.co/pMS00DriIR a través de @La_SER" 
"1449";"El Defensor del Pueblo no cree la versión de Interior sobre la actuación policial en la valla de Melilla https://t.co/2jw3t6LjwV vía @La_SER" 
"1450";"La oficina de Ángel Gabilondo cuestiona punto por punto las explicaciones de Marlaska, entrega a la Fiscalía testimonios y partes médicos de superviviente y pide que se deje de expulsar ilegalmente a la gente. https://t.co/99a1HteBCy" 
"1451";"La oficina de Ángel Gabilondo cuestiona punto por punto las explicaciones de Marlaska, entrega a la Fiscalía testimonios y partes médicos de supervivientes y pide que se deje de expulsar ilegalmente  <U+270D><U+0001F399> Una información de @JaviBanuelos y @NikoCastellano  https://t.co/41gqVZi6Ac" 
"1452";"Ni el defensor del pueblo, ni nadie.   https://t.co/6du7Aahq7t" 
"1453";"<U+0001F534> ÚLTIMA HORA | El Defensor del Pueblo no cree la versión de Interior sobre la actuación policial en la valla de Melilla  https://t.co/7KCACmlOi7  Por @JaviBanuelos y @NikoCastellano https://t.co/R2A9djISgT" 
"1454";"<U+0001F6A8> ÚLTIMA HORA | El Defensor del Pueblo pone en cuestión la versión dada por Interior sobre la tragedia en la valla de Melilla tras visionar las imágenes del helicóptero   Informa @JaviBanuelos https://t.co/IXeZ2mO1Gi" 
"1455";"@rtvenoticias Qué pesaditos estáis con la valla de Melilla a ver si arregláis la sanidad y os dejáis de tanta valla" 
"1456";"Viñeta de hoy en @deia_eus ,@NotGip y  @NoticiasdeAlava #Ministerio #Interior #Melilla #Valla #Crisis #GuerraSucia #Marlaska #Barrionuevo https://t.co/rdrZ7jXokm" 
"1457";"<U+0001F534>#ACTUALIDAD   MARLASKA REFUERZA LA VALLA DE MELILLA CON SOLO CINCO AGENTES DE LA BENEMÉRITA.   Los cinco agentes no tendrán tampoco material extra. https://t.co/Y8QdeS8nw0" 
"1458";"Ante la negativa de Marlaska a comparecer y facilitar los vídeos, tendrá que ser Sanchez quien dé todas las explicaciones. Así lo hemos registrado esta mañana en el Congreso.  El escándalo de la sedición no debe tapar lo ocurrido en la valla de Melilla. https://t.co/uCO5gf8HWA" 
"1459";"<U+0001F3A5> Bolaños, sobre lo que ocurrió en la valla de Melilla: ""Marlaska ha comparecido ante el Congreso, ha facilitado todos los vídeos que tenemos, claro que el helicóptero tiene que repostar y por eso hay unos minutos que no hay imágenes. Mayor transparencia no se le puede pedir"" https://t.co/li5Y7rBOge" 
"1460";"“Se te encoge el corazón al ver a personas saltar la valla, de manera violenta, es verdad”. Bolaños en @HoyPorHoy. No hay declaraciones del Gob sobre Melilla en las que no mencionen la “violencia”" 
"1461";"<U+203C><U+FE0F> @ivanedlm da a conocer una semana más los delitos cometidos durante los últimos días por parte de inmigrantes ilegales <U+2935><U+FE0F>  Necesitamos #FronterasSeguras y leyes útiles para expulsar de España a los que vienen a delinquir. https://t.co/JmJCR4RnZZ" 
"1462";"@Setdenou Aquí en Cataluña es más que eso. Es una sociedad esquizoide  y mezquina que prefiere a los inmigrantes ilegales o a sediciosos golpistas antes que a los catalanes que se sienten españoles y defienden la unión y concordia con el resto de España. Estos últimos somos unos apestados" 
"1463";"<U+25AA><U+FE0F> Detienen en Granada a un yihadista marroquí que ya fue detenido y puesto en libertad con la condición de que abandonara España.  <U+25AA><U+FE0F> En Palma. Envían a prisión a un argelino de 22 años por patronear una patera con ocho inmigrantes ilegales." 
"1464";"@Chentepoza Y nuestros padres, abuelos pagando y construyendo país. Es demencial la situación de España, la pérdida de calidad de vida, es fulminante.  De qué comen los inmigrantes ilegales y los legales que están requete parados desde hace meses o años???  A SUS PAÍSES DE INMEDIATO." 
"1465";"@okdiario Veo con impresión que España está repleta ya no de inmigrantes ilegales y encima ladrones, violadores y asesinos sino de nativos españoles que DEFEINDEN y JUSTIFICAN a esos ilegales ladrones, violadores y asesinos. Qué les pasa? Les falla el software o qué mierda?!" 
"1466";"@Cclope11 @GiorgiaMeloni Aquí en España se lo darían a chiringuitos feminazis, LGTBI, sindicatos, asociaciones de inmigrantes ilegales, y tú aplaudirías con las orejas..." 
"1467";"@rodrijr111 Nacionalización de sefardíes, de inmigrantes ilegales, de familiares de exiliados... Como no tienen suficientes votos en España y lo que menos les interesa es España y los españoles amplían la base de posibles votantes." 
"1468";"@nosoyelloco1973 @elcoreano441 Un millón de políticos Cuatro millones de funcionarios Cuatro millones de parados Diez millones de jubilados SIndicalistas, inmigrantes ilegales, ONGs, asociaciones feministas, ecologistas, de género, de animales, manteros.   En España no paga impuestos ni DIOS" 
"1469";"Barcelona, el estercolero de okupas, inmigrantes ilegales ,  golpistas.... de la mano de la morsa Colau !!  #TeamVox  https://t.co/gdDig8PlTh" 
"1470";"@PSOE @Pilar_Alegria Vosotros habéis permitido la entrada de inmigrantes ilegales a mansalva. Habéis importado lo peor del mundo, delincuentes, presidiarios, han entrado sin control todo tipo de gentes. Habéis convertido España en un paraíso tercermundista. Importáis la pobreza y destruiís la riqueza" 
"1471";"@inesbau95952328 @YorandoDias @RosaVillapostin @antoniomonterov @ToninoSanchz España, ese lugar del mundo donde sale gratis delinquir. Gracias a Antonio los violadores, pederastas, sediciosos, etarras, golpistas, okupas, sindicalistas subvencionados e inmigrantes ilegales están liberados, porque si gobiernan delincuentes... liberaran a los suyos. <U+0001F618>" 
"1472";"@corsair2525 @maariadess Ns si lo sabes pero la mayoría de delincuencia q hay en España son inmigrantes ilegales,q no digo q los  algunos españoles no estén idos pq de esos hay en todos los lados pero te lo digo para q te informes pq los queremos fuera" 
"1473";"@laSextaTV @AntonioMaestre Pues cuantos inmigrantes ilegales hay en España? Alguno cumple la ley? Eso parece que da igual" 
"1474";"@NoaGresiva Si tanto os preocupa los derecho de los homosexuales por qué permitís y favorecéis que vengan a España inmigrantes ilegales de esa cultura, que no respetan a los homosexuales?" 
"1475";"@sanchezcastejon @NATO Ti eres gilipollas, deja de meter inmigrantes ilegales que estás destrozando España y deja de preocuparte por terceros países con lo que tienes liado en el tuyo traidor..." 
"1476";"El principal problema que tiene ESPAÑA en estos momentos es la inseguridad. Los poderes legislativo y ejecutivo atentan contra la integridad del estado. El poder judicial no tiene armas para luchar contra los delitos.Las calles están tomadas por inmigrantes ilegales y pandilleros" 
"1477";"@JcQuer Problema Juan Carlos es que los que están en el gobierno no quieren que este tío se pudra en la cárcel le gustan los delincuentes los inmigrantes ilegales los ocupas toda la chusma que viene a hacer daño a España les encantan" 
"1478";"@ipeutrera @CORRUPSOE1 Se le echa de menos. España era un paraíso con él. Ahora es un estercolero tercermundista repleto de inmigrantes ilegales. https://t.co/epl0NUSrxO" 
"1479";"a parte de lo de Igualdad, Sánchez de PSOE y su (des)gobiernillo están llenando España de inmigrantes ¿ilegales? ¿parece una compra de votos por qué se ven perdiendo las elecciones? https://t.co/gvI2Mt7bP3" 
"1480";"@IgualdadLGBT No veo quejaros de todos los Menas e inmigrantes ilegales que no comen jamón y que llegan en manadas a España y para los cuales vosotros sois uno de sus objetivos. Os gusta más decir que VOX os persigue. Sois más falsos que Judas" 
"1481";"El psoe ha convertido España en 1 basurero donde los violadores,los asesinos,los terroristas,los ocupas,los inmigrantes ilegales,los q dan golpes d estado,los asesinos al volante,los q no cumplen la ley,los q causan disturbios,etc... todos tienen + derechos q las víctimas <U+0001F621><U+0001F621><U+0001F621>" 
"1482";"@el_pais Y más racismo que veréis si seguís llenado España de inmigrantes ilegales." 
"1483";"@PabloEchenique Ahora que viene el mundial lo críticas pero todos los inmigrantes ilegales que han hecho destrozos en España te calla la boca como una rata política..." 
"1484";"@skaly2004 @CapitanBitcoin La España del año 99 al 2004 fue el mayor coladero del mundo. Aznar hizo dos regularizaciones masivas. Zapatero regularizó a los ilegales que habían entrado los tres últimos años de Aznar. Rajoy regaló la nacionalidad española a cientos de miles de inmigrantes." 
"1485";"<U+203C><U+FE0F>@vox_es ES LA SOLUCIÓN.  1<U+FE0F><U+20E3> Expulsión inmediata de inmigrantes ilegales. 2<U+FE0F><U+20E3>Expulsión de inmigrantes legalizados que cometan delitos. 3<U+FE0F><U+20E3>Proteger la identidad nacional y priorizar la inmigración de aquellas naciones hermanadas culturalmente con España.  <U+0001F7E2> https://t.co/qC8y4NHIcH https://t.co/Hjp6Bc4iYM" 
"1486";"@skaly2004 @CapitanBitcoin Con el anti socialista Aznar dirigiendo el Estado España fue el mayor coladero de inmigrantes ilegales del mundo." 
"1487";"@JoseViedma6 @Jaleosa_ @javiernegre10 Racista por reclamar que tienen mas derechos los inmigrantes ilegales que un propio Español en España? Vale" 
"1488";"@obmtmd @Hoyuelicos @PoderJudicialEs Donde no hay inmigrantes ilegales vendiendo productos robados , no salen violadores a la calle y muchas cosas , y es un gobierno de izquierdas , pero vamos , en españa lo mismo dice vox y son nazis <U+0001F923><U+0001F923>se basan en los nazis si , a matar judíos" 
"1489";"@jbsg65 Tantas promesas y visitas de Sanchez y es tofo mentira..sin embargo a los inmigrantes ilegales les dan pagas y los meten en buenos pisos y gratis...y en Canarias los metian en hoteles 4 estrellas y les pagaban el viaje de avion a peninsula..España para los españoles.. @PSOE" 
"1490";"La Policía detiene a tres inmigrantes ilegales marroquís, con antecedentes penales, por robar un móvil armados con una navaja en Jaén https://t.co/k14ZN6Dx24" 
"1491";"@FranJimnez18 Plop... los que se cagan de hambre son los inmigrantes ilegales q llegan en masa a chile<U+0001F937><U+200D><U+2642><U+FE0F>no el chileno comun y corriente... asi que no sea agrandado, aparte q españa es el pais pobre de la union europea jajajaja" 
"1492";"@miqueliceta @EliseoOliveras @ElPeriodico_Esp No nos tomen el pelo, ¿ que carencia de trabajadores?, en España hay un 35%  de paro JUVENIL, Y no se fomenta la tasa de NATALIDAD, al contrario disminuye día a día, no ayudan a las familias para que tengan hijos, traen INMIGRANTES ILEGALES PARA PRODUCIR CAOS Y PUNTO." 
"1493";"Mensaje que se envía a todos los inmigrantes ilegales potenciales de todo el mundo: ""venid a España ilegalmente y sin papeles. No importa. No pasa nada. Entrareis igualmente, os quedareis, os daremos papeles tarde o temprano, luego os daremos trabajo, triunfareis en la vida ..." 
"1494";"Efecto llamada... Mensaje que se envía a todos los inmigrantes ilegales potenciales de todo el mundo: ""venid a España ilegalmente y sin papeles. No importa. No pasa nada. Entraréis igualmente, os quedaréis, os daremos papeles tarde o temprano y trabajo  https://t.co/pk3VP3bsEU" 
"1495";"@RosaVillacastin @NunezFeijoo Desprestigiar a España es enfrentarse a Argelia, dejar vendidos a los saharauis, permitir que Marruecos ponga piscifactorías en territorio español, estar sometidos al chantaje de Marruecos con envíos masivos de inmigrantes ilegales o hacer lo que ellos digan (a saber por qué)." 
"1496";"@Puntual24H Presidente dimisión has permitido mucha mierda no has sido capaz de limpiar España <U+0001F1EA><U+0001F1F8> dios bendiga España <U+0001F1EA><U+0001F1F8> has soltado a los violadores pero que te gustaría que violen a tu hija o tu prima o tu hermana? O esque te va la marcha viva España libre de inmigrantes ilegales" 
"1497";"@SaraBallester18 Igual que tendrás que explicarles que por el hecho de ser españoles no van a tener los mismos derechos y ayudas que si fuesen inmigrantes ilegales que vienen a España a delinquir y vivir del cuento. Duro pero cierto" 
"1498";"@smilelissi La mayoría delincuentes. Los políticos españoles que están promoviendo o no impidiendo que España esté siendo invadida por decenas de miles de inmigrantes ilegales tienen que pagar por ello. Están cometiendo un delito de alta traición.." 
"1499";"@veintimillapier Es decir o bien vienen los inmigrantes ilegales a España o la unión Europea a sacarse las castañas calientes de las manos,con este tema" 
"1500";"@CristoStoich @ReturnAFortune Barcelona, España. la ciudad con más inmigrantes ilegales de todo el país jajaja <U+0001F602>." 
"1501";"@FibraSoluble @deloslares @gaceta_es @JavierVillamor @rubnpulido Muchos de esos ""seres de luz"" tienen los papeles en regla y vienen a España a trabajar de lo que  no queremos trabajar los españoles y otros son hijos de inmigrantes que han nacido en España. Pero es más fácil decir que todos son ilegales y que los engañan las mafias." 
"1502";"España,,,ese paraíso para okupas, violadores, sediciosos, malversadores, inmigrantes ilegales, golpistas,etarras, todo orquestado y creado por este maravilloso gobierno social comunista que llena de orgullo a Europa y que será recordado en los libros de historia(de su ley claro) https://t.co/IUi4Up6XlW" 
"1503";"Llenan España de inmigrantes que pululan sin control, violadores a la calle, subvenciones para perroflautas, okupas e ilegales. Un gran Gobierno para un gran País." 
"1504";"@HoyPorHoy ¿ Que los inmigrantes ilegales que llegan a España comparten esa forma de vida, de esos países donde asesinan homosexuales, tratan como a perros a las mujeres ?  No pasa nada. ¿ O si ?" 
"1505";"Moleste o no...los delitos contra la propiedad en España  los cometen mayoritariamente delincuentes inmigrantes ilegales, muchos de los cuales son menores magrebíes. Hay que cerrar la puerta a ese tipo de movimientos migratorios ya. https://t.co/VgnqR6Latr" 
"1506";"@lady_p0t0rr0 Las calles en vez de gente protestando están llenas de violadores e inmigrantes ilegales. La España que tú quieres: @PSOE, @Podemos y demás mierda zurda." 
"1507";"@Jimmyeduardfc @CaraballoEngels @tatianarosario Te recuerdo que los DDP son todos nacidos y criados en España...con nacionalidad española, no son inmigrantes ilegales indocumentados. No son un producto de RD. Lo que sucede es que el dominicano no reniega de su nacionalidad de ninguna forma." 
