"3627";"@Ruiz_Noticias Ceuta y Melilla, solo dos ciudades, tienen un déficit brutal. Con todo lo que conllevan en tema inmigración y Marruecos.. ¿No habría que abrir un debate sosegado? Empiezo a recibir a ostias en tres, dos, uno.." 
"3628";"El PP critica que el Gobierno no reclame a Marruecos el paso de mercancías por la frontera de Melilla - Europa Press https://t.co/YDrdKN3riz a través de @GoogleNews" 
"3629";"@JaimeFoG @carloselpika @NelsonE31062769 @RincnCuriosoo Ha dicho Marruecos y lo que está primero y delante desde hace siglos es Ceuta, España, detrás Marruecos." 
"3630";"@luistudanca Gente hay... https://t.co/swUw6mMD11" 
"3631";"@AugustoHidalgo_ @mjmonteroc @CarolinaDarias @PSOECanarias @psoegc @avtorresp @chanofranquis @psoelpgc ¿de que gente?https://t.co/swUw6mNaQz" 
"3632";"@RichieSargento @redondo_pacheco @PP_Ceuta @PSOE Envidiosos sois los españoles y España y lo saben jaja Envidian a Marruecos por todo. A ver si nos dejan los colonos chupa sangre a Marruecos y a los marroquíes en paz que no habrá ni aduanas comerciales ni nada <U+0001F602>" 
"3633";"@AugustoHidalgo_ @CarolinaDarias @PSOE @PSOECanarias Por el cambio¡¡¡ https://t.co/swUw6mNaQz" 
"3634";"@RincnCuriosoo En realidad se ve mucho más cerca. Ceuta y Melilla hacen frontera con Marruecos https://t.co/H80gcjY45H" 
"3635";"@pedro_casares @CarolinaDarias @psoelpgc @PSOECanarias @PSOE No sé cómo puede votaros un sólo canario... https://t.co/swUw6mNaQz" 
"3636";"Jebel Musa no está en Ceuta. Se ve desde Ceuta pero está en Marruecos.  Hacerle una foto es casi obligado cuando se viene de Algeciras a Ceuta en un día claro sin nubes que oculten el perfil de la mujer muerta. https://t.co/pbcyhh2Fxg" 
"3637";"@hijodeputapro @jesusdelacruzol @liusivaya Yo no veo la tele pipo, Ceuta y Melilla eran de España antes del reino de Marruecos y serán españolas hasta el fin del mundo, además la gente que vive allí sabe bien donde se vive mejor, así que déjate de historias fantásticas e irreales y deja de fumar cosas raras" 
"3638";"@SpainManuel @jesusdelacruzol @liusivaya optas por una explicación tan simplista y futbolera que el dia que el gobierno español (el que sea) le tenga que vender ceuta y melilla a marruecos en los proximos 40 años, dirás ""no eran tan importantes"" o ""eran suyas en un principio"" solo porque es lo que dicen en la tele" 
"3639";"@AugustoHidalgo_ @CarolinaDarias @PSOE En efecto, con vuestra NEFASTA gestión empezó todo...  https://t.co/swUw6mMD11" 
"3640";"@CarolinaDarias @PSOE Lo vas a hacer fenómeno... https://t.co/swUw6mMD11" 
"3641";"@MonederoJC @PodemosCanarias @PODEMOS Podemos se deshace como un azucarillo, lo que no deja de ser una mala noticia para el PSOE y una muy buena para España. https://t.co/swUw6mMD11" 
"3642";"¿Marruecos necesita un ejército para disuadir a España? Si sólo necesitan un silbato para que los que están aquí salgan a las calles a degollar y nuestros jóvenes antifascistas revolucionarios se echarían a llorar y se lo harían encima. Si tomaron Ceuta en una hora. Ala venga ya. https://t.co/fNl10wQnCR" 
"3643";"@oussamax_KC @alefrasa05 @YihiRM @papigavi Pero si marruecos ni existía, fantasma, sabes quién si tiene colonias en tu país actual ? Nosotros Ceuta y Melilla <U+0001F609>" 
"3644";"Ceuta, Melilla y Canarias abandonadas, el Mediterraneo un coladero de ilegales hacia España, Marruecos riéndose de nosotros a diario...y nuestras tropas ¡en Letonia!   https://t.co/JpQMZyxKSB" 
"3645";"China es XI Jinping. India jura lealtad a China, Rusia necesita a China. Usa, Inglaterra y Europa divididas. Marruecos reclamará Ceuta y Melilla. Ucrania ha perdido la guerra. Italia entra en barrena, Corea del Norte bombardea Japón. Arabia Saudí es muy peligrosa. Israel... https://t.co/5qrsgtOhX6" 
"3646";"El PP critica que el Gobierno no reclame a Marruecos el paso de mercancías por la frontera de Melilla https://t.co/uKYsImRlSv" 
"3647";"Artículo: Marruecos y los políticos españoles contra Ceuta y Melilla por el Coronel Jorge Pérez Blanca. https://t.co/52EL3Hv7Ii" 
"3648";"@Javier_Egea_ @WillyTolerdoo Los chinos antes que los del santuario de ETA, tiracamiones españoles ,veto a entrar en la ue y desindustralizacion, los de dar perejil Ceuta y mel a Marruecos, los que rajan de España en las reuniones con presos sudamericanos" 
"3649";"Regaló más, pera vaya, que lo recuerdes : que le vote Chapote y Junqueras  Sánchez regaló 20 millones a Marruecos 12 días después de negar la españolidad de Ceuta y Melilla: https://t.co/Hchdf26VVl" 
"3650";"@osa1_pilardela El tema de Marruecos con Ceuta, Melilla y las Canarias de fondo." 
"3651";"<U+0001F1EA><U+0001F1E6><U+0001F1EA><U+0001F1ED><U+0001F1E9><U+0001F1FF><U+2694><U+FE0F><U+0001F1F2><U+0001F1E6> Esto pasaría si Marruecos intenta tomar Ceuta y Melilla" 
"3652";"@DiegoGa78822725 @raudoyveloz12 @HRarox @Pit_von_Torian @liusivaya A ver si lo entiendes..Nadie gana nada con la INVASiÓN criminal rusa, Ucrania se defiende como país soberano como quizás nos toque hacer algún día con Ceuta, Melilla y Canarias.España solo puede estar con el respeto a la integridad territorial de Ucrania. https://t.co/nADZHocGcA" 
"3653";"@raudoyveloz12 @Jose87771550 @HRarox @Pit_von_Torian @liusivaya Que cojones gana España en esta guerra? Estáis tontos o qué? El día que Marruecos se quede con Ceuta y Melilla esperar sentados la ayuda de los americanos y la OTAN" 
"3654";"Una unidad de choque que, aparte de reclutar, vestir y entrenar a sus propios hombres, se compone de ocho banderas, cuatro de ellas en #Ceuta y otras cuatro en #Melilla y dos escuadrones de caballería. La guerra de #Marruecos comenzará con su fase final. https://t.co/HZ0GhnEPD7" 
"3655";"@alexx__xix Que Fermín no mienta, que ahí pone claramente que ven como restos coloniales a Ceuta, Melilla, y Canarias. Por lo tanto, si ellos hablan de la unión federal sin forzar, y son anticolonialistas ¿Qué van a hacer con esos territorios? Pues entregárselos a Marruecos." 
"3656";"@pedro_casares @sanchezcastejon @PSOE No se si te estas creyendo tu mismo tus palabras. Creo que no, porque... - Marruecos nos ningunea, y encima, exige Ceuta y Melilla. - No protege todo nuestro territorio el 'paraguas OTAN'. - Biden NUNCA tuvo una reunion formal con Pedro Sánchez para cerrar a niveles importantes." 
"3657";"Se acuesta con un marroquí y quiere que le regalemos Ceuta y Melilla a Marruecos. https://t.co/vhfeykNWLl" 
"3658";"https://t.co/7D6HWm4Sk9 pero si doce q ya estan en ceuta otra vez...evidentemente tienen q volver a su pais y q los crien sus padres o gobierno al no saber usar condon pr control de natalidad y no tener pr mantenerlos" 
"3659";"El 1 de abril, España cedía su parte del protectorado al Marruecos independiente, conservando los territorios sobre los que poseía la soberanía nacional, como Ceuta, Melilla y el Sáhara occidental. Termina con ello la larga presencia colonial española en la región. https://t.co/cOBBuDd3LJ" 
"3660";"@alejosudamerica O de Ceuta, frontera con Marruecos...<U+0001F606>" 
"3661";"@andrescabrero @desdelamoncloa @DelegGobMl @sabrinamohh @ConGloriaRojas @MarotoReyes @mincoturgob @ElFarodeMelilla @CEME_MELILLA Marruecos aplica el régimen de viajeros que tiene establecido oficialmente como le viene en gana discriminando a los viajeros que entran por Ceuta o Melilla. O   @desdelamoncloa se pone firme en las negociaciones o habrá que pedir el auxilio de @ComisionEuropea como con Argelia" 
"3662";"<U+0001F4F8> Margarita Robles, ministra de Defensa de España, visita Ceuta en medio de las tensiones con Marruecos https://t.co/Axr5S8CgwG" 
"3663";"<U+0001F449><U+0001F3FB> Toda Asociación Marroquí está al servicio de Marruecos <U+0001F1F2><U+0001F1E6> país cuyo objetivo es anexionarse #Ceuta. Ahora se les invita para decirnos lo bien que marcha el proceso de marroquinización orquestado a manos de los cobardes del <U+0001F17F><U+FE0F><U+0001F17F><U+FE0F> y sus socios promarroquíes del PSOE <U+0001F339><U+0001F1F2><U+0001F1E6> https://t.co/RGsgB1FrCp" 
"3664";"@JonInarritu Aquí es donde evidenciamos que España no tiene más política exterior que la voz de su amo y lo que afecta a Melilla y Ceuta es asunto del moderno Estado feudal que es Marruecos. España soberana e intervenida; como muy bien supo ver Joan Garcés." 
"3665";"“La nueva relación con Marruecos está ya beneficiando a Ceuta” https://t.co/mpbjwU0WkE a través de @ceutaldia" 
"3666";"<U+203C> TOMA DE POSESIÓN - Felix Bolaños: ""debemos seguir caminando por la senda de la lealtad institucional"" El ministro de la Presidencia se ha referido también a las relaciones con Marruecos. Conozca AQUÍ lo que ha dicho <U+2B07> https://t.co/yGH0vsk7Vx #Ceuta #Bolaños #Marruecos" 
"3667";"Ceuta, Melilla y Canarias abandonadas, el Mediterraneo un coladero de ilegales hacia España, Marruecos riéndose de nosotros a diario...y nuestras tropas ¡en Letonia!   https://t.co/9bUjov8fKd" 
"3668";"han puesto las dos banderas esp. dónde se celebraba la cena boca abajo,///PEDRO SÁNCHEZ todavía NO ha dado ninguna explicación de lo HABLADO en esta HUMILLANTE CENA ,en què RATIFICO   el apoyo PERSONAL  al REY de MARRUECOS con su política sobre el SÁHARA, CEUTA , MELILLA etc https://t.co/sSo7nGfJJy" 
"3669";"@slifante Pues tiene la misma explicación que cuando ando en España, una exministra y un expresidente dicen de regalar Ceuta y Melilla a Marruecos." 
"3670";"Lección de historia territorial# los Estados Unidos apoyarían a mal Marruecos reivindicando Melilla y Ceuta a ello les diría estáis dispuestos a ceder a los indios el territorio que ocupáis" 
"3671";"<U+203C> Tres de los menores que fueron devueltos a Marruecos, citados en el Juzgado #Ceuta https://t.co/QcvRHo4o2a" 
"3672";"@redondo_pacheco @PP_Ceuta @PSOE Ceuta y Melilla acabarán siendo Marruecos <U+0001F1F2><U+0001F1E6><U+0001F60E><U+0001F4AA>" 
"3673";"@redondo_pacheco @PP_Ceuta @PSOE Con la asfixia de Marruecos todos están bien jodidos<U+0001F602>  Pp psoe y terroristas de vox<U+0001F917>  Arriba Marruecos y la economía marroquí <U+0001F1F2><U+0001F1E6><U+0001F60E><U+0001F4AA>" 
"3674";"<U+0001F449><U+0001F3FB> De ahí no salen. Ojo el riesgo de que la alcaldía de Ceuta, pase de Plaza de África al Principe es certero. El @PP_Ceuta está entregando la ciudad al @PSOE <U+0001F339><U+0001F1F2><U+0001F1E6> y la posibilidad de que #Ceuta sea gobernada desde el Principe y tutelada por Marruecos, está más cerca que nunca <U+2B07><U+FE0F> https://t.co/uVFlssU373" 
"3675";"@Cs_Europa @jordi_canyas @PlayMelTv Ceuta y Melilla ya no se mantendrán Acosta de Marruecos y su economía y el bienestar de los marroquíes. Mirad al norte o a Argelia y dejadnos en paz <U+0001F606>" 
"3676";"@Cs_Europa @jordi_canyas @PlayMelTv Dejad de tonterías,Marruecos no está violando nada con la UE y todo acuerdo entre Marruecos y la UE no incluye los enclaves de Ceuta y Melilla." 
"3677";"@Cs_Europa @jordi_canyas @PlayMelTv Entre La UE y Marruecos ya circulan todo tipo de mercancías y personas pero desde las verdaderas aduanas de Marruecos en el Mediterráneo,Tángermed y el nuevo Nadorwestmed.  Marruecos no puede tener otras aduanas con Ceuta y Melilla teniendo a estos grande puertos al lado." 
"3678";"@Cs_Europa @jordi_canyas @PlayMelTv Ceuta y Melilla son un mal para Marruecos y para la economía marroquí y Marruecos solo debe asfixiar a estos enclaves para evitar pérdidas económicas..." 
"3679";"@altamiranoMLG @HoraAfrica CeutA y Melilla son españolas antes de que existiera Marruecos . Y tu una puta rata traidora" 
"3680";"@davidf_71 @diegogbm_ @andriy_ht No recuerdo cundo Marruecos tuvo en el pasado alguna presencia en Canarias, Ceuta o Melilla." 
"3681";"@_JorgeSLL_ @diegogbm_ @andriy_ht Según Marruecos, España es imperialista por Ceuta, Melilla y Canarias. ¿Crees que tienen razón?" 
"3682";"@altamiranoMLG @HoraAfrica Ceuta y melilla estas ciudades estan en marruecos" 
"3683";"@AlejoSchizo @carloswax @Bracamontelea15 Pero, ¿por qué me llamás islamófobo sin base alguna que lo fundamente?. Marruecos solo reclama Ceuta y Melilla y otras plazas que son soberanía española, me da que te estas confundiendo con el Estado Islámico. Me estás divirtiendo con tus falacias, sigue así." 
"3684";"@Villabona1926 @inNomineSomnium @EmbajadaRusaES @abc_es @elmundoes @elpais_inter @larazon_es @okdiario @eldiarioes @elcorreo_com @publico_es @sextaNoticias @A3Noticias Si hoy mismo Marruecos toma Ceuta y Melilla el gobierno no haría nada" 
"3685";"@psoe_m @JLUISGARCIAS22 Por supuesto que merecen todo el respeto y condiciones dignas, lo mismo que se lo MERECEN los compañeros de las FFCCSE destinados en Ceuta y Melilla. https://t.co/zECHI5pisB" 
"3686";"La ministra de Defensa española visita en Ceuta al grupo de Regulares y la Legión, en medio de las disputas territoriales con Marruecos. Es la primera vez en 26 años que un ministro de Defensa visita la ciudad autónoma española" 
"3687";"Mohamed VI, como en su día su padre, nos conocen y tienen bien cogida la medida, mientras que, por el contrario, nosotros ni un ápice a ellos. Marruecos sabe lo que quiere (Ceuta, Melilla y las Canarias) y está dispuesto a lograrlo dedicando a ello cuántos esfuerzos de todo" 
"3688";"@altamiranoMLG @HoraAfrica No creo!gibraltareños, ceutís y melillenses son los primeros en quedarse como están!Ell@s son los que deciden!Lo que debe hacer Marruecos y España es trabajar en hacer el puente/túnel del Gibraltar (así Marruecos puede ingresas en la UE<U+0001F605>)y abrir las aduanas en Ceuta y Melilla!" 
"3689";"#Efeméride: 17/11/1720. En un día como hoy PROCESIONA EN ROGATIVAS la VIRGEN DE LOS REYES por el ASEDIO de CEUTA, también llamado SITIO DE LOS 33 AÑOS. Fue un bloqueo armado de Marruecos sobre Ceuta, del 23 de octubre de 1694 hasta... Completo <U+0001F447> https://t.co/lPoC2PjBk3 <U+0001F4F8> 1910. https://t.co/ygSqv9nqUr" 
"3690";"<U+0001F1F2><U+0001F1E6> Marruecos está violando el acuerdo comercial con la UE.  Asfixia a #Ceuta y #Melilla bloqueando las fronteras europeas para potenciar sus puertos.  La pasividad del Gobierno de España le convierte en cómplice.  <U+0001F4FA> @jordi_canyas en @PlayMelTv <U+23EF><U+FE0F> https://t.co/r8VwspPRko https://t.co/pwr5L6QotN" 
"3691";"@manuelruizisac @Roberto_Montesa Nuestro Ministerio de Asuntos Exteriores tiene demasiado miedo a contrariar a #Marruecos, pero es fundamental restablecer la estabilidad estratégica, algo que va en beneficio no solo de #España, sino también de nuestros vecinos.  https://t.co/KDWpJpstvK" 
"3692";"@encisope La guerra híbrida terminará con la ocupación de Al Andalus.    Marruecos no tolera pié español en Ceuta, Melilla y Canarias." 
"3693";"@FuggenKatten Según Marruecos, Ceuta y Melilla les pertenece." 
"3694";"China presenta su más moderno sistema de defensa aérea: el HQ-11 ///? MARRUECOS ya anunció que 2023  COMPRARIA y  LO Instalaría cerca de Ceuta  https://t.co/sWfTHrY3fh vía @zonamilitar1" 
"3695";"@sanchezcastejon @Bundeskanzler @EmmanuelMacron @g20org Eres un basura por que no entra en otan Ceuta y Melilla? Que sabe marruecos  de tus basuras y las de begoño? Ladron traidor" 
"3696";"cerca de su casa, gasto en Sanidad y Educación recortado, donaciones al Bill Gates hechas, fondos europeos (ni la UE sabe donde están), vuelos en Falcón por el medio ambiente = muchos, golpistas catalanes indultados, Ceuta y Melilla a punto de ser de Marruecos ( y a ver Canarias)" 
"3697";"@AlejoSchizo @carloswax @Bracamontelea15 La verdad que es pura paranoia conspiranoica lo que dices. Cómo mucho Marruecos reclama Ceuta y Melilla. Los que querian reconquistar el Andalus eran los taraos del Isis, aunque da igual, déjalo, sigue con tu fiesta en tu cabeza." 
"3698";"@MorenoArrones @bimbalalombarda @javierbustosr @Cazatalentos Venga de donde venga, aquí hay un invasor y un invadido. A ver si Marruecos empieza tirar bombas por el sur de España e intenta entrar en Madrid, empiezo a justificar que Ceuta y Melilla, que los musulmanes, que Al-Andalus y mierdas así como hacen ustedes con una ocupación" 
"3699";"Jajajaja! <U+0001F606><U+0001F606><U+0001F606> Un lacayo del imperio sueña con que la gente sea tan necia como él mismo. ¿A caso desconoces que la OTAN no nos va a defender en caso de que Marruecos ataque Ceuta, Melilla y/o Canarias?  Jóóóder con los ""lacayitos""!... Mírate los protocolos, jambo! https://t.co/9mcSjeRQIV" 
"3700";"@TheEuroFE NO ES UN TERRITORIO ESPAÑOL EN MARRUECOS, SI ACASO ES TERRITORIO ESPAÑOL EN AFRICA, CEUTA EXISTE ANTES QUE MARRUECOS SE CONSTITUYERA COMO PAÍS, UN POCO DE HISTORIA POR FAVOR" 
"3701";"Me temo que si el PSOE gana las siguientes elecciones España estará sentenciada.   Está avanzando demasiado y luego tendría 4 años más para consolidar lo avanzado esta. Consultas de secesión catalana y vasca, cesión de Ceuta y Melilla a Marruecos...  Y la gente no lo ve. https://t.co/VlInFtxNic" 
"3702";"- Mira Peter, en unos años Marruecos se quedará con Ceuta y Melilla y tú no vas a hacer una mierda o te montamos un euromaidan como Ucrania. - ¿La culpa será de Putin, no? https://t.co/edm6LAVkbX" 
"3703";"@valenciaplaya @icembrero @EMADmde @Defensagob otro tonto marcha verde hacia ceuta nunca habra, no estoy seguro que los ceuties podran vivir en un enclave sin negocios y sin vender nada a Marruecos organisaran una marcha hacia la peninsula <U+0001F978>" 
"3704";"El #EstrechodeGibraltar fe #noche #nuboso  costa de #Marruecos #TangerMed #Ceuta https://t.co/WvjHtZcofm" 
"3705";"@ilegalvictimas Es evidente que Marruecos está haciendo una marcha verde sobre Canarias, Ceuta y Melilla," 
"3706";"@beauvilliers_ Con respecto a los desplazamientos. Lo lógico sería un primer paso de aumento de tensión con Marruecos y se detectarian movimientos de tropas. Tiempo suficiente para rearmar tanto Canarias como Ceuta y Melilla y el flanco sur de Andalucía." 
"3707";"@snukedogg_fella @Julioroto34 @KenJGOD @elmundoes Ese país tan poderoso es el mayor aliado de Marruecos (el que reclama Ceuta y Melilla) o de Reino Unido (el de Gibraltar y nuestro enemigo ancestral). Por lo menos usted reconoce que prefiere someterse por miedo, otros creemos que ESP ha de ser soberana, como Carrero Blanco." 
"3708";"La ministra de Defensa de #España, Margarita Robles, visitará el jueves #Ceuta, ciudad fronteriza con #Marruecos. Es la primera vez en 27 años que un ministro/ministra de Defensa pone pie en Ceuta. Eso demuestra que Ceuta es ""especial"" @EMADmde @Defensagob https://t.co/sGm01qZeYo" 
"3709";"Estar en el centro del tablero internacional debería traducirse en que el pellejo de vino que Marruecos tiene por rey no pudiese chantajearnos, pero le hemos regalado el Sáhara Occidental y estamos a diez años de que el PSOE le entregue Ceuta y Melilla. https://t.co/HmgrlQDJwv" 
"3710";"@sanchezcastejon @Bundeskanzler @EmmanuelMacron @g20org ¿Qué sabe Marruecos de ti para dejar a Ceuta y Melilla a los pies de los caballos? #SanchezTraidor  #PSOEBandaCriminal" 
"3711";"@escaparnstnis @kangorooo51 @GalileoArms ""Bajo la misma regla"", va a ser que no. Es como decir que Ceuta y Melilla son colonias, al igual que Gibraltar. Los intereses de España y la OTAN distan mucho de ser los mismos. De hecho, me pregunto qué bando eligiría EEUU en caso de conflicto entre España y Marruecos." 
"3712";"@montse__garcia @sanchezcastejon La marioneta globalista recibiendo órdenes. A ver Antonio:  1- tienes que dejar que Marruecos te invada y te quiten Ceuta y Melilla. En un futuro cañarías. 2- tienes que entrenar a 2400 soldados nazis ucranianos. 3- tienes que arruinar a la gente, que las colas del hambre crezcan" 
"3713";"“entendidos” del fútbol de #Ceuta y otros , antes de soltar veneno x vuestra boca,busquen información antes de despotricar. Mallda ha sido convocada x la selección de #Marruecos <U+0001F1F2><U+0001F1E6> #FútbolSala <U+26BD><U+FE0F> por ser nieta de marroquíes no tiene por qu tener nacionalidad marroquí para jugar. https://t.co/XIkc8hNWC9" 
"3714";"@JipsyJuan @will_pulido Siento decirte que la OTAN no va a defender Canarias de Marruecos. Ni Ceuta, ni Melilla. La OTAN básicamente es el brazo armado de los EEUU, y nosotros importamos menos que Marruecos." 
"3715";"#LosDosReyes,en Ceuta,donde @pradobenjamin la empezó. 6º caso de #JuanUrbano,”que llevará al lector de un Marruecos enigmático a Ceuta y Melilla, de París y el norte de Europa a la Granada de Las mil y una noches, en una trama llena de aventuras, dobles identidades y peligros.”<U+0001F942> https://t.co/6XZ33SCyKb" 
"3716";"@Villabona1926 @EmbajadaRusaES @abc_es @elmundoes @elpais_inter @larazon_es @okdiario @eldiarioes @elcorreo_com @publico_es @sextaNoticias @A3Noticias Las aguas serán escenario de batallas y piratas. Sin embargo, Ceuta y Melilla también interesa económicamente a Marruecos que sean españolas porque es su puerta a chantajear a la UE y vender sus productos en ella." 
"3717";"@BeatrizTalegon @JosepBorrellF @vonderleyen Pues lo mismo van a hacer cuando Marruecos ataque a Ceuta, Melilla o las Canarias. Dirán que es un error" 
"3718";"@RIVERS793 @JosePatrinuri @JuanLabordah No intentes confundir a la gente aunque quizás sea tu función, la  democracia me gusta, pero de seguro que la tuya es diferente. A Marruecos pueden irse los que piensan que Ceuta y Melilla no son españolas." 
"3719";"@rod_denarvaez @sito_1983 @Madrileo12 @elmundoes Marruecos nos come la polla y lo saben. No hace falta contar tanques, nosotros tenemos un potencial muy superior en inteligencia y mucha mejor infraestructura de geolocalización debido a Ceuta y Melilla y Canarias." 
"3720";"@Villabona1926 @EmbajadaRusaES @abc_es @elmundoes @elpais_inter @larazon_es @okdiario @eldiarioes @elcorreo_com @publico_es @sextaNoticias @A3Noticias Ahora piensa en España, Pedro Sánchez de rodillas a cambio de nada mientras EEUU sirve en bandeja Ceuta y Melilla a Marruecos. Al final tendremos lío con las ciudades autónomas o Canarias." 
"3721";"@Dav_man9 @quierodormir123 @AlertaNews24 Será pobre, que no es el más pobre de Europa, pero ya nos gustaría a nosotros recibir tal cantidad de ayuda en caso de que Marruecos haga algo en Ceuta por ejemplo." 
"3722";"@YosiphRGT Pues nada, dejemos que Putin invada lo que quiera, dejemos que Marruecos se haga con Ceuta, Melilla y Canarias, dejemos que Cataluña proclame una DUI...  DEJEMOS QUE LOS CRIMINALES CAMPEN A SUS ANCHAS, CLARO QUE SÍ." 
"3723";"Imagínate si Marruecos ataca Ceuta y Melilla que no están incluidos en la OTAN, Marruecos que lleva años comprando los intereses de Francia y Estados Unidos. Van a ayudarnos enviándoles material e información a Marruecos. Me he desviado del tema, pero ahí lo dejo." 
"3724";"Menos posados @sanchezcastejon  E incluido Ceuta y Melilla, bajo el amparo automático de la OTAN Ya nos han advertido que la respuesta no sería automática A USA le interesan más los recursos de marruecos" 
"3725";"Aquí nadie da la cara y lo único que queda claro es que el estado español paga millones de euros a Marruecos para acabar con la inmigración ""sea como sea"". https://t.co/xH5HRhDImf" 
"3726";"@sanchezcastejon Que les den a Polonia y a Ucrania como nos dan a nosotros frente a Marruecos. Y tú si fueras español y no un traidor antiespañol proetarra con corbata y pinta de figurín y camuñas, estarías exigiendo medidas contra Marruecos y la inclusión de ciudades españolas de Ceuta y Melilla" 
"3727";"NO, ES, NUESTRA, PUTA, GUERRA. Y la OTAN se puede ir a la mierda, ya que lo único que sirve es para utilizarnos como peones y en caso de lo que nos tendría que preocupar (conflicto con Marruecos) NO cubre la defensa de Ceuta y Melilla, de verdad que no. Y encima <U+0001F1EB><U+0001F1F7>y<U+0001F1FA><U+0001F1F8> arman a <U+0001F1F2><U+0001F1E6>." 
"3728";"@DonosoDM @J_Zaragoza_ Valiente patriota. Vendió terreno español q los yankees, que años atrás arruinaron España con la guerra del 98. Más tarde, también perdería ese miserable Guinea Ecuatorial, Sáhara, Ifni, norte de Marruecos, casi las prometidas a los moros en la guerra, Ceuta y Melilla, etc" 
"3729";"¿Un país no miembro de la OTAN puede bombardear a un país de la OTAN y no pasa nada? Lo digo por nosotros por Ceuta y Melilla, vaya que Marruecos haga algo y nos tengamos que joder. https://t.co/jU0IxDqDKl" 
"3730";"@RotcivGorki @sanchezcastejon @MorawieckiM El día que Marruecos le apetezca apoderarse de Ceuta y Melilla, que lo harán si nos ven débiles no te quepa duda, les lanzaremos piedras" 
"3731";"@RosaVillacastin @pedro_casares @sanchezcastejon @PSOE Se te ha olvidador añadir que Sánchez quiera entregar Ceuta y Melilla a Marruecos, pues si le tenemos 4 años más a Sánchez creo por lo que he escucuhado  permitiría  la doble gobernabilidad de dichas ciudades autonómicas entre España y Marruecos, espero que Feijoó llegue a poder" 
"3732";"Del 22 al 24 de noviembre el Centro Asociado de la @UNED en Ceuta organiza las interesantísimas jornadas ""El norte de Marruecos: una mirada sobre los aspectos económicos, sociales y culturales del protectorado español a partir de 1922"". Más info aquí: https://t.co/bBqjKVptqL" 
"3733";"@ilegalvictimas Ahora le darán una paga, dirán que no tiene familia y le falta calor de hogar, traerán a su familia desde Marruecos, nos dirán que son sus costumbres y hay que empatizar, nos dirán que es mejor darles Ceuta, Melilla y las Canarias para que no vengan. Y todos tan felices." 
