"1";"<U+0001F6A7> España necesita #FronterasSeguras para frenar la inmigración ilegal que amenaza con convertir nuestros barrios en no-go zones.  <U+0001F449> @TeresaGdVinuesa ""Nuestras fronteras están siendo atacadas por miles de inmigrantes"". https://t.co/j76pgxnCfg" 
"2";"La @policia desarticula una red criminal que introducía a inmigrantes ilegales en España con el fin de enviarlos después a #México para terminar en #EEUU.  España como país preferente de entrada y tránsito. Un paraíso para las mafias de la inmigración.  https://t.co/36xQKXJVFA" 
"3";"Marlaska solo ha reforzado con cinco agentes la plantilla de Melilla pese a la presión de la inmigración ilegal.  No han mejorados los recursos, ni incrementado los efectivos, como siempre, los agentes pagan la irresponsabilidad de otros.  https://t.co/bWClMCUh6I @TheObjective_es" 
"4";"#España #Inmigración  Y así nos toman el pelo. Magrebí viene en patera tirando la documentación para que no haya rastro, rescatado por Salvamento Marítimo y posteriormente llevado a #Burgos donde conduce un Mercedes a su libre albedrío.  Vía @rubnpulido https://t.co/Xgfsd0VXla" 
"5";"@FisicoImporta @JuanPina Es decir que si te vas a lo que la falange va a hacer realmente o quiere hacer y quitas* 1 propuesta solamente (inmigración) y la palabra España que es solo adorno ya que a nivel práctico no quiere decir nada. Anula el 99% del resto de propuestas? Increíble..." 
"6";"@budino_antonio Gobierno de España Defensa,Seguridad de las fronteras,Seguridad Ciudadana,C.Penal, Educación,Sanidad,Familia,Trabajo,Unidad de la Patria,Okupacion viviendas,inmigración ilegal,etc. Han sido incapaces de hacer nada antes, durante y después de la pandemia. Gestión nefasta. VOX!" 
"7";"@franmacos Esto no es inmigración es una INVASIÓN PERMITIDA POR ESTE GOBIERNO TRAIDOR,.  VIVA ESPAÑA LIBRE <U+0001F4AF><U+0001F4AF><U+0001F4AF><U+0001F1EA><U+0001F1F8><U+0001F1EA><U+0001F1F8><U+0001F1EA><U+0001F1F8>" 
"8";"@CasoAislado_Es @JAVIERCLARK16 Esto no es inmigración, es una INVASIÓN PERMITIDA POR ESTE GOBIERNO TRAIDOR , VIVA ESPAÑA LIBRE <U+0001F1EA><U+0001F1F8><U+0001F1EA><U+0001F1F8><U+0001F1EA><U+0001F1F8>" 
"9";"@BarrioSeguro_es Por fin un reportaje realista de la inmigración que viene a España." 
"10";"<U+2708><U+0001F3E2> ¿Qué es el #traslado #intraempresarial de trabajadores? El traslado de trabajadores extranjeros a España es relativamente sencillo, en comparación con otros trámites de inmigración. ¡Os lo contamos!  #Tips #Consejos #Extranjeros  https://t.co/yvaJn1b2hv https://t.co/kuLEQbJLcX" 
"11";"@f_zorzin @EmmaRincon Claro pero el gobierno progre de España trajo la mayor inversión industrial desde hace 50 años a Valencia pero no saben gobernar mientras a libertaria derecha solo habla de inmigración y valores heterosexuales (vale verga)" 
"12";"@igj777almeria @grafico_rebelde @CristianBilba12 En España ya están diciendo que o nacen más niños, o más nos vale que abramos el grifo con la inmigración, porque no se va a poder sustentar." 
"13";"<U+0001F5DE><U+FE0F> ""VOX siempre ha defendido: rechazo frontal a la inmigración ilegal y defensa de aquellos que tienen los papeles en regla""  <U+0001F1EA><U+0001F1F8> AE: ""La inmigración debe ser legal, controlada, adaptada a las necesidades y con capacidad y voluntad de adaptación.""  Fin hilo https://t.co/adXbscB6XL" 
"14";"¿Han leído @OmellaCardenal y la @Confepiscopal las propuestas de @vox_es?  <U+2705> VOX defiende la vida <U+2705> VOX derogará TODAS las ""leyes Trans"" <U+2705> VOX defiende la inmigración legal y ordenada <U+2705> VOX denuncia el ""suicidio demográfico""  #PerpectivaDeFamilia  Hilo https://t.co/E3bOeLhHlG" 
"15";"“Fue una decisión complicada, pero fue algo muy importante para mí”  Patrick Sequeira será uno de los rivales de España en su primer partido en Qatar  Salió de Costa Rica solo con 17 años para perseguir su sueño  #JuegoDirectoLaLiga #EsLaLiga | @LaLiga  https://t.co/exyw63Fnhq" 
"16";"Ministra de España defeniendo la inmigración ILEGAL y a los ILEGALES Asco y vergüenza https://t.co/UshJH55ozG" 
"17";"@navedelmisterio @EPGalicia Los de siempre Luego a los policías que alertan que inmigración ilegal = delincuencia  los cesan Pues nada. Sigamos permitiendo que la puta basura inunde España Hasta que el apuñalado, asesinado o violada; sea el hijo/a de un político progre Ahí ya seguro que cambian las cosas" 
"18";"La policia federal brasilera tiene instrucciones d entorpecer la inmigración d peruanos y bolivianos por considerarlos gente muy dañina para su país, pero existen acuerdos de reciprocidad internacional q tienen q cumplir. En España ocurre lo mismo, los cambas son mejor aceptados" 
"19";"La inmigración compensa la tasa vegetativa negativa de España ¿Que opinas tu? #españa @ESdiario_com https://t.co/NQ3Uoi9CxQ" 
"20";"Con independencia de los jardines en los que se mete Montero, España es uno de los países con las penas más altas por violación (15 años). La dureza de las penas no intimida al potencial agresor. A ver si va a estar relacionado con el aumento de inmigración ilegal." 
"21";"Otro exitazo de la política de reinserción y de control de fronteras. Una nueva víctima evitable. Hasta cuándo @sanchezcastejon? Millones para @IgualdadGob y las mujeres en España hoy son más vulnerables que nunca. #INMIGRACIÓN #metoo #NiUnaMenos #NiUnaMas #Mujeres #niñas https://t.co/bBufNPNXiL" 
"22";"#Mallorca #España #Inmigración  Un argelino de 21 años ha sido detenido por la @policia por abusar de una menor de edad en Mallorca.  El argelino llevaba dos días en España y era la segunda vez que entraba de forma irregular al país en patera.  Tenía antecedentes previos." 
"23";"Esto hacen los Irlandeses cuando se enteran que les están metiendo inmigración irregular, a solo hombres y no mujeres y niños, como les decían. Políticos MIENTEN y se piden explicaciones...#España DESPIERTA COÑO <U+0001F92C><U+0001F92C><U+0001F92C> https://t.co/g7vb9URG20" 
"24";"llegada de estos ""seres de luz"" cuando se quedan en otro país, lo complicado es asumirlo cuando vienen al tuyo! España e Italia son de los países más castigados por una ""inmigración"" que llega para invadir, para vivir a costa del trabajo de los demás, para imponerse! <U+2B07><U+FE0F><U+2B07><U+FE0F><U+2B07><U+FE0F>" 
"25";"«España tiene que invertir primero en su gente antes de recurrir a la inmigración» https://t.co/gcw6JIzfyDía vía @elcorreo_com" 
"26";"«España tiene que invertir primero en su gente antes de recurrir a la inmigración» https://t.co/gcw6JIyHJ5ía vía @elcorreo_com" 
"27";"La inmigración de Colombia y Ucrania frena la caída poblacional de España: https://t.co/P5lurVjtPg #larazon_es" 
"28";"@IgualdadLGBT Lo has descubierto hoy? Que sepas… que toda la inmigración ilegal que está entrando en España tiene esa mentalidad. Esa inmigración ilegal que defendéis todos los progres." 
"29";"@sanchezcastejon @unicef_es Con las fronteras abiertas y la inmigración sin parar de llegar a España, el pais con mas paro de la UE, sabes de sobra que se aumenta la pobreza, pero es lo que buscáis, pobreza para proclamaros defensores de los pobres, ya no cuela pedrito" 
"30";"@veintimillapier Y que hace un marroquí con antecedentes todavía en España??? Tiene trabajo??? Leyes de inmigración más duras. Si delinques fuera." 
"31";"@BarrioSeguro_es Les han robado a los de welcom refugees?? Vaya, ya han tenido contacto con esa inmigración que tanto les gusta y que están encantados que llegue a España. Me alegro." 
"32";"@vox_bcnciudad @vox_es Lo d naciones hermanadas culturalmente con España a q se refieren? A l Pacha mama, a la katrina, a la Narcoiglesia.. - demagogia q no esconde l intereses económicos creados! Tenemos drcho a Polít d inmigración donde prime el bienestar d l españoles! No d invasiones!!!" 
"33";"Cádiz: desindustrialización, inmigración ilegal, desempleo y la asfixia de Gibraltar https://t.co/5P6yJVA5np via @gaceta_es Pero a quien se le ocurre poner de alcalde a un podemita teniendo por seguro que esto pasaría" 
"34";"«España tiene que invertir primero en su gente antes de recurrir a la inmigración» https://t.co/ayW012bNiQ vía @nortecastilla @InfoAquona @aquonatrabpal" 
"35";"""España tiene que invertir en su gente antes de recurrir a la inmigración"" https://t.co/8WwFP5iWFi vía @heraldoes" 
"36";"@J_Zaragoza_ El gobierno de España tiene 20.000 millones para las charos del ministerio de desigualdad que dirige Irena Montera y solo tiene 20 centimos para el transporte, y tiene millones para los menas e inmigracion ilegal y no tiene para un medicamento que cura el cancer porque es caro" 
"37";"@macariomx Uuuu pero ahí están los buenaondita de Alemania, Francia, Holanda, Bélgica, Suecia, España suicidándose con la inmigración musulmana." 
"38";"@tom202269 @cloudfield3 Pero la pregunta de ""¿Comen jamón?"" se suele decir en Twitter España haciendo referencia a si son musulm<U+0430>nes y el tema de la inmigración ilegal. Por ejemplo, cuando hay una noticia de que alguien ha cometido un crimen, pues viene uno y hace esa pregunta." 
"39";"Este comisario europeo de Luxemburgo dice una gran verdad...  Por desgracia el Internet ya no es libre ni para poder leer las noticias sin pagar...  Una pena que Vocento no quebrara, los directivos italianos siempre buscando rascarle a los pobres...  https://t.co/geEtzctHqz" 
"40";"@Vox_Molina @MolinaPolicia Llevo años viendo a gente con orden d expulsión en el bolsillo y donde están? En España y delinquiendo! No echan a nadie incumpliendo la ley d inmigración.. pero es q el gobierno d Rajoy tmpoco echaba a nadie con orden d expulsión oscuros planes para el nuevo continente EURABIA" 
"41";"@Cclope11 @GiorgiaMeloni Si quieres sacamos las cuentas y vemos cuantos millones de euros da tu querido gobierno para la inmigración descontrolada que entra en España. Seguramente te tocaría darte un puntito en la boca antes de soltar la primera parida que se te ocurre." 
"42";"España <U+0001F1EA><U+0001F1F8> Inmigración ilegal Los musulmanes no respetan a las mujeres españolas. Los españoles no ponen freno a esa violencia contra sus mujeres. Están adormilados, no reaccionan... https://t.co/RURX5f2vCz" 
"43";"Sabías que<U+2753> La población Latina <U+0001F30E>, en el año 2022, tiene el mayor índice de inmigración exitosa <U+2705> hacia España, si quieres conocer las opciones que tienes para hacer tu sueño de vivir en Europa una realidad.  Escríbenos <U+0001F4F2> https://t.co/AjJ4esjemI" 
"44";"Omella, al inicio de la plenaria: crisis de natalidad, inmigración ordenada, aborto y ley trans... https://t.co/ox9WKHcBqm a través de @relibertad" 
"45";"@Lumenzurdo @Pingc34ac @Puer_Hispano Los países del norte extraen recursos materiales y humanos de los del sur, ya te lo dije, eso implica inmigración cualificada.  España es lo que es, una potencia media, con la mejor calidad de vida de europa" 
"46";"Omella, al inicio de la plenaria: crisis de natalidad, inmigración ordenada, aborto y ley trans...  https://t.co/a1ME1IZ5te" 
"47";"Inmigración en el siglo XIX  Argentina recibe a los inmigrantes provenientes del continente europeo, mayormente de países como España e Italia. https://t.co/Uq0T49jR60" 
"48";"@joseantoniokast @monasterioR @hermanntertsch Este pelotudo anda cavando zanjas en España ahora. Imagino q propuso una zanja en el estrecho de Gibraltar para detener la inmigración africana a Europa" 
"49";"Así son los profesionales que tendrán trabajo en 2022 en España https://t.co/moNCgkltbC #economia #ayudas #sociales #ayudas #del #gobierno #iberoeconomiaes #refugiados #asilados #inmigracion #beneficios #economicos" 
"50";"Solo para suscriptores de EL CORREO On+ |  «España tiene que invertir primero en su gente antes de recurrir a la inmigración» https://t.co/QWHpJTu0eO" 
"51";"Nicolas Schmit, Comisario europeo de Empleo y Derechos Sociales: «España tiene que invertir primero en su gente antes de recurrir a la inmigración» Considera que España debe caminar hacia salarios más altos y una productividad mayor, «lo que implica más formación». https://t.co/uXFGvCohGh" 
"52";"@JAVIERCLARK16 Esto no es inmigración , es una INVASIÓN PERMITIDA POR ESTE GOBIERNO TRAIDOR, VIVA ESPAÑA LIBRE de SOCIALCOMUNISTAS," 
"53";"#ElSuceso Ministerio de Salud Pública anuncia la aplicación de anticuerpos para ayudar a fortalecer el sistema inmunitario de los recién nacidos prematuros con el fin de contribuir a la reducción de la mortalidad neonatal en el país LEA MÁS<U+0001F449>https://t.co/HKtjdWWxvY https://t.co/nio172t1sD" 
"54";"@liber3volution @DonSoriano_ hola, me apetece debatir, opino que si españa prohibiese de una vez la inmigracion ilegal los moros si vendrian a trabajar de verdad y no a vivir de ayudas sociales, que opinas tu" 
"55";"#Inmigración    España. Un apunte sobre la estadística de migraciones del primer semestre de 2022. https://t.co/uACRHahLxT" 
"56";"España <U+0001F1F2><U+0001F1E6> Inmigración ilegal.  La mujer apaleada con odio por un repugnante inmigrante marroquí <U+0001F1F2><U+0001F1E6> en Cartagena: «Abracé a mi niña y esperé a que dejara de reventarme»: https://t.co/GD16nHm41H" 
"57";"Omella, al inicio de la plenaria: crisis de natalidad, inmigración ordenada, aborto y ley trans... https://t.co/fXJrqNdPB0 a través de @relibertad" 
"58";"Hoy me sacan en este reportaje algunas cosas que señalé en una larga entrevista sobre #inmigracion y movilidad social de los hij@s de inmigrantes. #socialinclusion #discrimination #mixedness #belonging @InmixUab @AntropologiaUAB  (abro hilo<U+0001F447><U+0001F3FD>) (1/7)  https://t.co/z2spYgvcuz" 
"59";"@SocialDrive_es @ENGINEER_28 Son las indudables ventajas de la inmigración ilegal descontrolada.  Entre PSOE y PPOE han convertido a España en el retrete migratorio mundial." 
"60";"@S4vitar No es por ahí Tito...  Dimensionemos lo importante que es para Argentina.  Si hasta ahora no reventó todo (política, economía, sociedad), es pq la gente quiere llegar al mundial.  Y si no ganamos... <U+0001F440><U+0001F4C9><U+2620><U+FE0F>  España... Inmigración... Medio país durmiendo en tu casa..." 
"61";"Hablas bien de Franco: franquista  Criticas a Irene Montero: machista  Exiges una política seria de inmigración: racista  Estás en contra de los continuos chantajes de los partidos catalanes y vascos: fascista  Defiendes la unidad de España: franquista otra vez  Estás en... <U+0001F53D>" 
"62";"@elfrusci @Alfonso55799813 @abc_es Los arabes estan en plena invasión interna, solo hay que ver las tasas de natalidad en España de arabes y ""blanquitos"".  Eso sumado a la inmigración ilegal y los ""refugiados"".  Hasta un ciego puede verlo." 
"63";"@JMPresidente23 Las leyes de inmigración, restringiría la entrada a ilegales, control absoluto de fronteras, expulsión de toda la delicuencia que nos han metido en España procedente de Argelia y Marruecos principalmente. Retirada de la nacionalidad española al extranjero que delinque." 
"64";"Subir salarios, invertir en Educación, contar con las mujeres, personas mayores en edad laboral, reducir el número de ninis… ¿Quién se podría imaginar que ese era el mejor camino para crecer en vez de la reducción de derechos?  https://t.co/mDr2fQflc7" 
"65";"«España tiene que invertir primero en su gente antes de recurrir a la inmigración» | El Norte de Castilla https://t.co/JJRoez9fHm" 
"66";"@mjosecatala @popularesVLC @ppcv @popularescorts Las dos causas principales que provocan el aumento de las violaciones a las mujeres son leyes emitidas u omitidas por la izquierda: 1. Omisión de la ley de inmigración, por la que se deja entrar gente a España sin control. 2. Emisión de la ley de ""Sí es sí"", que suaviza condenas." 
"67";"@IgualdadLGBT Pero apoyáis que esa cultura indeseable y obsoleta llegue a España en forma de inmigración ilegal. Algo falla en vuestra lógica." 
"68";"<U+0001F1EA><U+0001F1F8> España tiene que invertir primero en su gente antes de recurrir a la inmigración <U+0001F449>Tenemos un paro juvenil del 30% <U+0001F449>Lo dice el Comisario Europeo de Empleo y Derechos Sociales a nuestro Gobierno <U+0001F49C>#Socialcomunista https://t.co/MqStK0D2Y5" 
"69";"Uy, mira. De esto, no dicen nada. https://t.co/Rqfs3Hfu84" 
"70";"El Nuncio anuncia que la Santa Sede ""tomará decisiones para asegurar el futuro de los seminarios en España"": Advierte del aumento de los suicidios y la falta de respuestas ante el ""invierno demográfico"" en España   ""El suicidio no es una tragedia solo… https://t.co/Cjwifn5pPR https://t.co/8EQ1vX4Gmt" 
"71";"«España tiene que invertir primero en su gente antes de recurrir a la inmigración» | El Comerci - https://t.co/2ENDdeE5Ey #GoogleAlerts" 
"72";"@PSOE Esto es innamisible! BASTA YA! #PedroSanchezDimision A cumplir condena en su país de origen, y que no pueda regresar a España en todo lo que le queda de vida! <U+0001F92C> Inmigración regulada! https://t.co/HK7VpcziZE" 
"73";"Hasta los jefazos del norte lo reconocen:  Nicolas Schmit | Comisario europeo de Empleo y Derechos Sociales «España tiene que invertir primero en su gente antes de recurrir a la inmigración»  https://t.co/YrcMTRBbge" 
"74";"«España tiene que invertir primero en su gente antes de recurrir a la inmigración» https://t.co/G1lio4agVBía a través de @elcorreo_com" 
"75";"El Comisario Europeo de Empleo y Derechos Sociales @NicolasSchmitEU <U+27A1><U+FE0F> «España tiene que invertir primero en su gente antes de recurrir a la inmigración» | El Correo https://t.co/ieR2nIx35S" 
"76";"Titular así, es mal intencionado, malvado y peligroso. Pero eso ya lo saben....  https://t.co/1r7WWn0HV9" 
"77";"Nicolas Schmit: ""España tiene que invertir en su gente antes de recurrir a la inmigración"" https://t.co/fDwcfaSIkl a través de @heraldoes" 
"78";"@javiernegre10 ""La extrema derecha intenta vender en su relato la combinación entre inmigración, criminalidad e inseguridad como algo natural, pese a que las criminalidad se reduce en España año tras año y que no existe correlación alguna entre flujo migratorio y aumento de delitos""" 
"79";"«España tiene que invertir primero en su gente antes de recurrir a la inmigración» https://t.co/Z3fnGuH4qMía a través de @elcorreo_com" 
"80";"@perearagones @sanchezcastejon para cuando españa tendra pliticas inmigracion como Gran bretaña  Alemania, papeles solo a los que demuestren compromiso comunitario, extradicion violentos https://t.co/6aOk8lYkle" 
"81";"«España tiene que invertir primero en su gente antes de recurrir a la inmigración» https://t.co/YfGyge3u1l" 
"82";"«España tiene que invertir primero en su gente antes de recurrir a la inmigración» | <U+2B50> Contenido exclusivo para suscriptores  https://t.co/uctpbfGRmy" 
"83";"«España tiene que invertir primero en su gente antes de recurrir a la inmigración» https://t.co/o8Erf0PjRjía vía @elcorreo_com, Y que tiene q decir él Gobierno y Yolanda Díaz a todo esto? Primero nuestras gentes y luego los q vengan de fuera pero legales no ilegales." 
"84";"P.D.: y sí, España puede invertir en ""su"" gente y, a la vez, recurrir a la inmigración. No es excluyente." 
"85";"Es un error tratar de gestionar las migraciones con la mirada puesta únicamente en las necesidades del mercado laboral del país de acogida.  Mini hilo de 4 tuits  https://t.co/EhtVUXE9iV" 
"86";"Y ahora qué? O éramos fachas o somos fachas todos o simplemente teníamos razón los que decimos esto desde hace 20 años. «España tiene que invertir primero en su gente antes de recurrir a la inmigración» https://t.co/DWXUeJMzkbía" 
"87";"«España tiene que invertir primero en su gente antes de recurrir a la inmigración». Mi compañera @BarandiAna entrevista al comisario europeo de Empleo, que considera que debemos caminar hacia salarios más elevados y una mayor productividad y formación. https://t.co/UFIvVtEC7f" 
"88";"«España tiene que invertir primero en su gente antes de recurrir a la inmigración» https://t.co/ewz7U5bK9Y a través de @nortecastilla" 
"89";"Nicolas Schmit, Comisario europeo de Empleo y Derechos Sociales: «España tiene que invertir primero en su gente antes de recurrir a la inmigración» https://t.co/ZCUrjNtoP5" 
"90";"@Ayo_miiii @Laxix6 Argentina tuvo poca gente negra, cuando se independizo de españa abrio sus puertas a inmigracion, los inmigrantes que recibio fueron mayormente de europa, les daban tierras para producir e incentivos para hacerlo, de africa llevo poca gente, y bueno el resto fue mestizaje" 
"91";"@Rita_Maestre Precisamente aquí en España es un tipo de inmigración muy determinada q aplaudís." 
"92";"Más allá de que es una humorada, es importante destacar que Argentina tiene una doble corriente de influencia de estos pueblos. La que viene junto con los conquistadores producto de la previa conquista en España de parte de su territorio y la que vino con la inmigración del XIX https://t.co/gg5O8l4nIT" 
"93";"@Patchgirl Y el café es mucho mejor que en España también <U+0001F923> (mucha inmigración italiana a mitad del siglo XX)." 
"94";"@ionebelarra A mi lo que pasara en Argentina hace 200 años me importa un pie.  2022, España: familias sin poder pagar los recibos de luz y agua, familias pobres, paro por doquier, inseguridad, violadores en las calles, inmigración ilegal violenta, miseria, abandono y suciedad. Gracias a vos." 
"95";"@PabloIglesias A mi lo que pasara en Argentina hace 200 años me importa un pie.  2022, España: familias sin poder pagar los recibos de luz y agua, familias pobres, paro por doquier, inseguridad, violadores en las calles, inmigración ilegal violenta, miseria, abandono y suciedad. Gracias a vos." 
"96";"@Yolanda_Diaz_ A mi lo que pasara en Argentina hace 200 años me importa un pie.  2022, España: familias sin poder pagar los recibos de luz y agua, familias pobres, paro por doquier, inseguridad, violadores en las calles, inmigración ilegal violenta, miseria, abandono y suciedad. Gracias a vos." 
"97";"@PabloEchenique A mi vuestra binariedad me importa 1 pie. 2022, España:familias sin poder pagar los recibos de luz y agua,familias pobres, paro por doquier, inseguridad, violadores en las calles, inmigración ilegal violenta, miseria, abandono y suciedad. Gracias a vosotros. #ileglizacionpodemos" 
"98";"@psoe_m @juanlobato_es 2022, España: familias sin poder pagar los recibos de luz y agua, familias pobres, paro por doquier, inseguridad, violadores en las calles, inmigración ilegal violenta, miseria, abandono y suciedad. Gracias a vosotros.  #devolvedlorobado #ilegalizacionpsoe" 
"99";"Una historia genuina que cuenta la llegada de Vasil a España, un búlgaro que se queda en casa de un desconocido porque no tiene dónde ir. Una película que habla de lo compleja que puede ser la comunicación y que trata de manera sensible la inmigración. Emotiva y con corazón. https://t.co/QbauystI5M" 
"100";"¿Defensor del Pueblo? Jaja, defensor de los subsaharianos, defensor de la #inmigración irregular, defensor de la degradación de nuestras ciudades, defensor de la inseguridad y el aumento de delitos de todo tipo...  Y @populares ídem. https://t.co/NsT4f5BKUs a través de @ABCespana" 
"101";"Ola  @vox_es  Imaxino que ides con España no Mundial da Vergonza. A portada do  @marca  de hoxe está pensada para vós. Os irmáns Williams van ao Mundial, como eles din ""porque nuestros padres se jugaron la vida"". Un caso de inmigración real.  https://t.co/PkqxXUSW35" 
"102";"<U+0001F464>Niño Becerra lo tiene claro: así se acabará el envejecimiento de la población de España  <U+27A1>El economista niega que la inmigración o la jubilación tardía resuelvan el problema https://t.co/halZHFqK3q" 
"103";"@BarrioSeguro_es Hasta que no los vea a todos estos ilegales violentos, embarcar en un barco dirección Marruecos, no dormiré tranquilo.  Inmigración, legal y controlada, según las necesidades laborales de España, no queremos inmigrantes delincuentes." 
"104";"@Rojilla65 @populares Mayoría de Gente activista con fines políticos para eso necesitan llenar ESPAÑA de inmigración copia fiel del libro De Castro, copias de todas las marchas de Vzla, autobuses llenos, etc SOLO MIENTEN Y ENGAÑAN a gente q no revisa ni escucha a los q ya pasamos por esto en 20 años" 
"105";"No se qué más tiene que pasar en Batán: detenido un joven ex tutelado por asaltar el polémico centro de 'menas' de Batán armado con un cuchillo y un martillo.   Los vecinos, desesperados… https://t.co/cyIEuxrbUF" 
"106";"Detenidos cuatro 'menas' del centro de la Casa de Campo tras robar en un kiosco, una autocaravana e intentarlo en un restaurante del Lago https://t.co/9KLsKYcqYJ" 
"107";"@Ribetito @Isabelperezmoi1 Cuando se entere que el 90% de los llamados MENAS son niños abandonados españoles le estalla la cabeza, igual así se da cuenta de lo racistas que son estos hijos de p. Que tanto los odian." 
"108";"@ben_inma Y los menas en hoteles ." 
"109";"@Cristinaalcor @Hardcorcon Se nota que el PSOE te da de comer eh. Vete por ahí a meter menas en tu casa si tienes cojones" 
"110";"<U+0001F4F7> Andrew Holbrooke 'Algunas flores' Hay cuadros que parecen fotos y fotos que parecen cuadros. #UnaFotoAlDía https://t.co/0SpSmpDQL1" 
"111";"@blanquivoleta @anadeaustria_ Pues empieza por los menas" 
"112";"@Xaparranxo @ColeTho69386303 @enanoguia @belvis09 @Gurutxe1 Vete tú a la mierda con tu rollo católico. Paletos que no saben que adoran al primo de Ala y de Jhave que nació en Judea. Se sientes españoles los menas." 
